symbol,datetime,headline,source,url
NVDA,2025-12-06 06:35:00,Which Artificial Intelligence (AI) Stocks Are Billionaires Buying the Most?,Yahoo,https://finnhub.io/api/news?id=37b52b9f1262638768e2c52c5394d4041b6dbc1299aa3998fb3bbd3d3be48fc3
NVDA,2025-12-06 03:00:00,Nvidia vs. Everybody Else: Competition Mounts Against the Top AI Chip Company,Yahoo,https://finnhub.io/api/news?id=a605c71c1acd54e9c5ca6066f3f9ad8a8d40a3e2970c3783eac977180ed81a43
NVDA,2025-12-06 02:31:05,"Jensen Huang Reveals AI's Biggest Problem, And It Is Not Chips — Joe Rogan Agrees This Is The 'Smartest' Way To Solve It",Yahoo,https://finnhub.io/api/news?id=2d0b60f068f58642a2b7f2e545368f08bccc949e4c48aa06a4de19a1e33a97b9
NVDA,2025-12-06 01:35:00,Prediction: Nvidia Will Become a $10 Trillion Company in 2030,Yahoo,https://finnhub.io/api/news?id=ea52d55241e30a657a53735bf04c8efa5bf2fe12a255773ea7ae9669a49c6b3a
NVDA,2025-12-06 01:30:40,Jim Cramer Names One Of His 'Absolute Favorite' Stocks,Yahoo,https://finnhub.io/api/news?id=c6561efd1b7c88f8440672c86664defc259f461ea6639076b94b4b0bfe572842
NVDA,2025-12-06 01:25:00,"Why An Investment Process Matters, Especially In Volatile Markets",SeekingAlpha,https://finnhub.io/api/news?id=c417eb957ae4970d4fee444b415e778a6d808895125796009e7538355ef7f245
NVDA,2025-12-06 00:30:08,"Nvidia CEO Says Nuclear Is AI's Future — Oklo, NuScale Ready To Roar Back?",Yahoo,https://finnhub.io/api/news?id=d3c2984211d627700c4de1f2e70ebef680385b3b68e0dc533f9e343bc7f246ac
NVDA,2025-12-05 23:35:00,Why Tech's Comeback And A 'Hawkish' Fed Could Change Everything,SeekingAlpha,https://finnhub.io/api/news?id=0a7b162764491315bb361a9ebbfa1833f5d426a0167a7ba75228669972c838da
NVDA,2025-12-05 22:50:00,Prediction: This Artificial Intelligence (AI) Stock Will Be Worth More Than Palantir in 2026,Yahoo,https://finnhub.io/api/news?id=10eed335388050091aee1551d7e1a8b885e0cdf30f8365c44cfa622a9902bdbe
NVDA,2025-12-05 22:20:00,Is This AI Software Stock About to Have Its Nvidia Moment?,Yahoo,https://finnhub.io/api/news?id=3157c91ba5ce94b7ca93c425540744fe5a6920ad8e9a09f97b6491927cb8c258
NVDA,2025-12-05 22:01:45,Taiwan Semiconductor Manufacturing (TSM): A Bull Case Theory,Yahoo,https://finnhub.io/api/news?id=cbb0bdf899afa48a6b4eb697b9941852bfa50f9c2538045cb08835459dbbfc3a
NVDA,2025-12-05 22:00:26,Amazon AWS message signals major moment for Nvidia rival,Yahoo,https://finnhub.io/api/news?id=65d9a325c492efa66bcb075a718a4696dbc61ec9dd799ea4fae24574b96524d8
NVDA,2025-12-05 21:28:14,"Stock Market Today: Nasdaq, S&P 500 Extend Win Streaks; Palantir Outshines Nvidia (Live Coverage)",Yahoo,https://finnhub.io/api/news?id=1a85c56acce189489840771d68f248e7dd1351adac02ca83463c426519721b35
NVDA,2025-12-05 21:04:40,"SpaceX reportedly in talks for secondary sale at $800B valuation, which would make it America’s most valuable private company",Yahoo,https://finnhub.io/api/news?id=ff7177ad2c4934455f572d88cd089f759e04498933e80922ce4214e01dbfc400
NVDA,2025-12-05 20:30:41,What's Going On With Nvidia (NVDA) Stock Friday?,Yahoo,https://finnhub.io/api/news?id=12cd0cbb134128c562b0e1eacf62c6e4d924957e803397acea83464242d15ccb
NVDA,2025-12-05 20:28:00,Are Wage and Price Controls in Our Future? Predictions for 2026.,Yahoo,https://finnhub.io/api/news?id=cad525cc86a55f45625a922bfe37961792d868f826980a322de25943dab73138
NVDA,2025-12-05 20:13:00,Cathie Wood’s latest move is alarming for big stocks,Yahoo,https://finnhub.io/api/news?id=c620dba0fa6443dc614fe157dc9e6c422bb2a12b5f56f7af78f8a871193a0765
NVDA,2025-12-05 20:08:53,Intel Corporation (INTC): A Bear Case Theory,Yahoo,https://finnhub.io/api/news?id=3423d1f7661e39ec57335c723d2c92e25bfba78ca3d9f319e455bb4685b1a0ca
NVDA,2025-12-05 20:01:00,"Got $3,000? 3 Artificial Intelligence (AI) Stocks to Buy and Hold for the Long Term",Yahoo,https://finnhub.io/api/news?id=a77b1291cf0745c93bf4e0259b9f1bf63d54362e4f1edd9dfc6f5b737c6e58e7
NVDA,2025-12-05 19:16:42,Inside the Secret AI Alliance Powering Tomorrow's Data Centers,Yahoo,https://finnhub.io/api/news?id=f5dfda5979085824b41095e954533862261f91516c0e81cd4634d6c08a62bdb1
NVDA,2025-12-05 18:45:33,4 Questions For The AI 'True Believers',SeekingAlpha,https://finnhub.io/api/news?id=6263368b8b70081753625802727bbdc511250e6c4627e00d835f614014c7b81b
NVDA,2025-12-05 17:53:44,"The AI pressure cooker: OpenAI, Nvidia and Google all on the move",CNBC,https://finnhub.io/api/news?id=dbe0d829c459ef0c1d85cbfc94b342673c77c0584d80a6451df42a18913e106f
NVDA,2025-12-05 17:43:44,"Amazon: Resilient Consumers, Reasonable Capex Outlook, And Flat Valuation Justify A Buy",SeekingAlpha,https://finnhub.io/api/news?id=43ebccc490085972e49e43fbebc03cc575bb258bd7287c1f44f454d7ea1faa47
NVDA,2025-12-05 16:31:00,3 Best Tech Stocks to Buy in December,Yahoo,https://finnhub.io/api/news?id=022e2ef5e400f58d5ea95b887fff0c32077e6d241de62a28524726a3dfd9628e
NVDA,2025-12-05 16:12:38,"Broadcom Stock, With Google's Gemini Premium, Holds Near Highs Ahead Of Q4 Results",Yahoo,https://finnhub.io/api/news?id=79dc3b0e2f0f3626c8ec1e973291a8d8ff3f18fdcdfd65c4339715c31ad83bf1
NVDA,2025-12-05 15:51:00,2 Monster Stocks to Hold for the Next 5 Years,Yahoo,https://finnhub.io/api/news?id=6acf1bd9d15a111bce14830e57f657365f436e8f9a0d488cec9f55601f365062
NVDA,2025-12-05 15:45:09,Nvidia CEO Jensen Huang Discusses How To Stay Committed To An Unproven Startup Before It Takes Off: 'Manifest Your Belief As Deeply As You Can',Yahoo,https://finnhub.io/api/news?id=0d61b0913bd0c5c70d9e46ad46af990a283b8bfeee620f7be2e8636ce7f9e803
NVDA,2025-12-05 15:29:38,Goldman Sachs' top strategist says there is an AI bubble — but not where everyone thinks,Yahoo,https://finnhub.io/api/news?id=84fae3d8658ac3e371adde4a7d7e8fb39794d492bb5355859e36b7e252451f50
NVDA,2025-12-05 15:28:36,Top Funds Get Googly-Eyed Over This Breakout AI Stock Not Named Nvidia Or Palantir,Yahoo,https://finnhub.io/api/news?id=b12d9e45ef38ae76c652a1f6b7c7202467aa6f4216c09ed62f2931a3fcdfe158
NVDA,2025-12-05 14:57:00,China’s Nvidia Just Jumped 400% on Debut. How the AI Chip Stocks Compare.,Yahoo,https://finnhub.io/api/news?id=98da4864335b3c7eb57501e30beced4dc45fcf84711ca28c07138921d775deb8
NVDA,2025-12-05 14:54:00,Add These 4 GARP Stocks to Your Portfolio to Receive Handsome Returns,Yahoo,https://finnhub.io/api/news?id=ccf701e90e2587ef5f64ee2cea9671d19501739ab38edb51a876590e47a5eeb1
NVDA,2025-12-05 14:50:43,China’s Nvidia rival jumps 500pc on stock market debut,Yahoo,https://finnhub.io/api/news?id=38cfd958f4a07c7f2775e4c7f19c9a481606a6a333aa8e80808907dc1da637f2
NVDA,2025-12-05 14:34:33,SoftBank’s Forty Percent Slide Raises New Questions About the AI Capital Cycle,Yahoo,https://finnhub.io/api/news?id=9c19d46cb66dc67c73e516e5dd31843fab93d959867697f1498efb72a867f04d
NVDA,2025-12-05 14:32:38,ChatGPT Thinks Nvidia Stock Price Will Close At This Price By The End of 2025,Yahoo,https://finnhub.io/api/news?id=60aac5d44cbe0911f302acdb904741946f63dbdee92d8e2e88dea8fb0f314349
NVDA,2025-12-05 14:27:59,China’s Homegrown Nvidia Soars in Market Debut,Yahoo,https://finnhub.io/api/news?id=e8636b55c026aaf29c9741fda4a89ffb1b86dc45892353437f8344f87b778b87
NVDA,2025-12-05 14:26:20,ChatGPT Thinks Alphabet Stock Price Will Close At This Level By The End Of 2025,Yahoo,https://finnhub.io/api/news?id=616f34d2a88250933c14ffbaeaed35e8f989c96fd7b6a0a918eb20715ff28c91
NVDA,2025-12-05 14:15:00,Wall Street Roundup: Netflix Buying Warner Brothers,SeekingAlpha,https://finnhub.io/api/news?id=b4006d9f56f43cb540d6d9f1a25522b815dd0f05690f8db3c12df21dbe4214e8
NVDA,2025-12-05 14:02:35,Taiwan Semiconductor: I Don't Think Growth Is About To End,SeekingAlpha,https://finnhub.io/api/news?id=418232d0cf93f77a70e8b0fb32f3c2802799f1cabad88649911da40c74b48363
NVDA,2025-12-05 14:00:03,Is Trending Stock NVIDIA Corporation (NVDA) a Buy Now?,Yahoo,https://finnhub.io/api/news?id=705bcfd885100d644dcf47b0bf20057cb8bb45d0b2801035658e55f3db392460
NVDA,2025-12-05 13:59:16,The Case For Rational Optimism In The AI Supercycle,SeekingAlpha,https://finnhub.io/api/news?id=d0e213fd7c0c8f427cd73912354d2548716d29e9d26233c167e5134c505a5bde
NVDA,2025-12-05 13:48:01,Google AI Chips Could Be a $900 Billion Goldmine -- Should You Buy GOOGL Stock Now?,Yahoo,https://finnhub.io/api/news?id=14ee7509a0d5bfa5d9e5754d5c26fe293a27972e951de304f3093ade8221a930
NVDA,2025-12-05 13:32:00,Buy Marvell Technology as a Potential Dark Horse of AI Chips in 2026,Yahoo,https://finnhub.io/api/news?id=7eea7e5d0e80508980c6d84c2fc9755b5eab39a894aa9dda8748b9eeccd9d9d5
NVDA,2025-12-05 13:00:42,"Nvidia, Palantir AWOL, But Top Funds Go Bonkers For This AI Mobilizer",Yahoo,https://finnhub.io/api/news?id=95cf3b5efe1709fe6c9fed86379b5346ed2312bedd2c9890553cd3c267dadaf6
NVDA,2025-12-05 13:00:07,"Nvidia one of the most 'consequential companies' in history, CEO says",Yahoo,https://finnhub.io/api/news?id=dc85e6ea1042782c26c0f94b0ee9f610f1b1f1afad3873607aae93aed6b67d10
NVDA,2025-12-05 09:58:39,"The New York Times sues Perplexity, alleging copyright infringement",CNBC,https://finnhub.io/api/news?id=ac8545a85302e26295b53f5a55361e35a4507e6af643850c1fab0542c954d0c2
NVDA,2025-12-05 09:47:35,The Club's top 10 things to watch in the stock market Friday,CNBC,https://finnhub.io/api/news?id=7e4621dad23aac370a133115c6d928f4e53e269b0d0ceda92e6924952cd052fd
NVDA,2025-12-05 09:00:29,Meta's Next Idea Could Be Bigger Than The Smartphone,SeekingAlpha,https://finnhub.io/api/news?id=a7080240613818632bb3831a4f11da0d1fe0f7db2a964bc1186c5558db07d7e2
NVDA,2025-12-05 09:00:28,Don't Fight The Tape - Buying The Bull Market's Second Act,SeekingAlpha,https://finnhub.io/api/news?id=fed787dad844a072ac575c2e15566bbe6d7b72c3f4d9f3731a5e943b8de2c635
NVDA,2025-12-05 09:00:00,Nvidia: The TPU Risks Look Heavily Overblown,SeekingAlpha,https://finnhub.io/api/news?id=0bf4e5e687c17797961bdd5a32780571a8a2e2c2e11c5bb50b416d976399f6f7
NVDA,2025-12-05 07:03:00,The Dividend Fund That Doesn't Behave Like One: CGDV's Market-Beating Strategy,SeekingAlpha,https://finnhub.io/api/news?id=60690629a8e91c0fbeb507bca170e9ff80dbfcb46addba2565c1572297ae52bc
NVDA,2025-12-05 06:55:00,Wall Street Breakfast Podcast: The Nvidia Of China Soars On Debut,SeekingAlpha,https://finnhub.io/api/news?id=a968304e14308354cdd6e05317c3156aa2749dde7e6701aa46f83e62a3fa9f3f
NVDA,2025-12-05 05:00:00,Market-Crushing AI Momentum: Top Robotics Technology Stocks,SeekingAlpha,https://finnhub.io/api/news?id=36b39696b15728411fd095a5c1684edcc28d085d2fe9c4a624ac5d5250890cb7
NVDA,2025-12-05 04:59:14,China Chipmaker Moore Threads Soars 502% After $1.1 Billion IPO,Yahoo,https://finnhub.io/api/news?id=99f691d4eba8ff3ff8a4ee25e802e4c3fd788fd2b36d97bd1f84887bcac2c97d
NVDA,2025-12-05 04:53:00,Chinese AI Chip Maker Moore Threads Makes Strong Debut After $1 Billion IPO,Yahoo,https://finnhub.io/api/news?id=cedc31813fabe2c9b7334c6f11d1b020876cdc854500e99802e21d5d1a995ada
NVDA,2025-12-05 03:10:19,NVIDIA Corporation (NVDA) Price Target Raised as Analysts Reaffirm Buy Amid AI Market Growth,Yahoo,https://finnhub.io/api/news?id=8d8aefd8954c31425b4067b903c7c67e361de78a8261a2deaa4090ed5dc4e16c
NVDA,2025-12-05 02:55:43,Why Innodata Stock Lost 23% in November,Yahoo,https://finnhub.io/api/news?id=8a204702e5f1af9aa75bea1e61ccc7a44e6f1fbfc9d570c99a2710ec89d41d89
NVDA,2025-12-05 02:52:30,"Amazon.com, Inc. (AMZN): A Bull Case Theory",Yahoo,https://finnhub.io/api/news?id=b0a379519e57ac2c35aad51a3cb647c0d12f10c1b8e810b7cbeb72f14470601c
NVDA,2025-12-05 02:28:52,"Amkor Technology, Inc. (AMKR): A Bull Case Theory",Yahoo,https://finnhub.io/api/news?id=183c6f0fe4f91b71bf8a1015adec2f82aaa21932d2fc38ee1d48fdad322a3c90
NVDA,2025-12-05 02:26:25,Alphabet And Amazon Proving Potential GPU Dominance Is Nvidia's Achilles Heel,SeekingAlpha,https://finnhub.io/api/news?id=7650df89ffa532d4e5fbfc1641f8f3939e27e74314ced638ed05e2fbc24e3e96
NVDA,2025-12-05 01:43:00,This Semiconductor Stock Is Up 165% in 2025. 1 Reason This Could Be Just the Beginning.,Yahoo,https://finnhub.io/api/news?id=d6c7818036d5892795a8334b6b4d80a32481d81a287419e396bb2eb866c2afb8
NVDA,2025-12-05 01:09:06,"Moore Threads, 'China's Nvidia', soars over 400% in Shanghai debut",Yahoo,https://finnhub.io/api/news?id=9d17d0e67e4eef1ac85b6022e3fe6e7b165adaa5564e6a07f40649f4d14fd3d2
NVDA,2025-12-05 00:06:00,Nvidia vs Taiwan Semiconductor Manufacturing: Which Artificial Intelligence (AI) Stock Is a Better Buy Right Now?,Yahoo,https://finnhub.io/api/news?id=af5f5d7572743d8824f473c60e24fb9785141976fca9de46187cc3a3e6b1f959
NVDA,2025-12-04 23:48:50,"Stock market today: Dow, S&P 500, Nasdaq futures trade flat as Fed-favored inflation data looms",Yahoo,https://finnhub.io/api/news?id=1d0b735c811d08679de4118f6dd59f82dbd9474e88aba5c6cd61a9d1cc6884b2
NVDA,2025-12-04 22:05:00,I Think These Are the 3 Best AI Stocks to Buy in December,Yahoo,https://finnhub.io/api/news?id=cca0d6bd9c4123a129093784767cd0ec66a4644640bff0b8ad00d24a3e62b9c9
NVDA,2025-12-04 21:56:00,Intel’s Turnaround Earns Our 1st ‘Chart of the Week’ Spotlight,Yahoo,https://finnhub.io/api/news?id=0d58062e64fb9573a4cf656165e12c4179b79c8c61afc7ec1ebc8bf5d4689c18
NVDA,2025-12-04 21:50:00,How Nvidia is outperforming AI competition with a lower valuation,Yahoo,https://finnhub.io/api/news?id=2331fa3132798135dfaf4ffc099e3aa8646086b6d15d8d83ded801435d3d19d9
NVDA,2025-12-04 21:49:00,Nvidia CEO Jensen Huang Just Won the AI Chip Restriction Battle,Yahoo,https://finnhub.io/api/news?id=753a66055d858f143c06df3a494097a7c2acedfb21efba7e7f58b0b3f85ea0ea
NVDA,2025-12-04 21:48:00,Micron Dumps Its ‘Crucial’ Business. That’s Not Why the Stock Is Down.,Yahoo,https://finnhub.io/api/news?id=9ba6b44e10de045477197e62e217884938245d1e1d243e390df5e0ce8c71c80a
NVDA,2025-12-04 21:32:00,AI Bubble? Non-Tech Stocks Worth a Look,Yahoo,https://finnhub.io/api/news?id=3773b8156d118b2a69c1ee97d8f957a813477dfa7d8556a059c8e141b056c078
NVDA,2025-12-04 21:10:59,HPE sees weaker quarterly revenue on AI server sales delay,Yahoo,https://finnhub.io/api/news?id=e17437b14aef0159f1c21e1675c99a09c808e48e3f7e834b966938832705ac2d
NVDA,2025-12-04 21:00:46,"Stock market today: Dow, S&P 500, Nasdaq end little changed as Wall Street's Fed rate cut conviction runs high",Yahoo,https://finnhub.io/api/news?id=8e373daeb738abe17c072990d561fdb0affd14d6c0285241e3299acdfe5ab5c8
NVDA,2025-12-04 20:58:46,Why AI infrastructure is 'unprecedented' compared to cloud buildout,Yahoo,https://finnhub.io/api/news?id=097e4ebe6d7dc1cde4e384968862ed2b54899fc69f2af8af7ba7c368d2c54e10
NVDA,2025-12-04 18:07:26,My Outlook For The Market In 2026: An Optimistic But Cautious Stance,SeekingAlpha,https://finnhub.io/api/news?id=6689686e7f93a7b5696a215ef772a2b33604ab92c19f4c84fdddbc412139422f
NVDA,2025-12-04 14:22:52,Stock Market Today: Dow Rises On Surprise Jobless Claims; Snowflake Plunges On Earnings (Live Coverage),Yahoo,https://finnhub.io/api/news?id=a53d908fa6bc606ba6078b92a7c297453e7beb8d47052c6e04a79c5003c8f1e2
NVDA,2025-12-04 14:22:00,Palantir Rebounds As Nvidia Partnership Lifts AI Momentum,SeekingAlpha,https://finnhub.io/api/news?id=ce03fa8550650b8ccefd84e801b0f8292b7a4c80ad1839f8f5d4392a673398c2
NVDA,2025-12-04 14:21:09,Nvidia's Jensen Huang discussed chip controls with Trump: Takeaways,Yahoo,https://finnhub.io/api/news?id=822d0d56ee6cfd52c4b2d1392b0ea4bd19871b4b915149bdff649b1e22bef592
NVDA,2025-12-04 14:10:27,"Nvidia CEO on AI chips, rate cut outlook, Dollar General: 3 Things",Yahoo,https://finnhub.io/api/news?id=df0844e182f5f033458a2b9ee79cc07143145e22b040a1bf565e698cb15eb482
NVDA,2025-12-04 14:05:00,Prediction: This AI Infrastructure Stock Could Hit a $500 Billion Valuation by 2032,Yahoo,https://finnhub.io/api/news?id=7d1c381d77235606e1552d509fa1b135e0dc11ca74a7e1d6d619bfc41ddbf651
NVDA,2025-12-04 14:00:00,Greenlight’s Annual Family Trends Report Uncovers Bright Spot in Consumer Finance: Kids are Building Wealth Through Investing,Yahoo,https://finnhub.io/api/news?id=c3db370f77b9f6ef968eb9d8ecaeba895fbd5cd68af793be9b3b7727c8d887f1
NVDA,2025-12-04 14:00:00,"Cohesity Recognized as ""Top Durable Growth and Innovation Partner, FY25"" in Cisco SolutionsPlus Program",Yahoo,https://finnhub.io/api/news?id=cfc6ec2ad64eadf1b3ccd5d6f4e0a1c65e0392219cc5cea64b5d8aefbebe59bb
NVDA,2025-12-04 13:59:36,Tesla Wants To Become Nvidia - It Can't,SeekingAlpha,https://finnhub.io/api/news?id=9d51478000b83c92b048e7c5db01a04d2537898041dbe2fd00721f707c62dffa
NVDA,2025-12-04 13:48:44,Crypto Reels From a $200 Billion Crash as Casino Crowd Moves On,Yahoo,https://finnhub.io/api/news?id=5650513d71640d60db8a97684c3275f4cad8919f692ee5d7846e442e9832a816
NVDA,2025-12-04 13:42:19,Nvidia Gets a Win in Washington,Yahoo,https://finnhub.io/api/news?id=72db278ac20bd7dc74fa9d87a1ee3f283d04c58cd46796b1bfea2f0882d2d023
NVDA,2025-12-04 13:35:27,Here are NVIDIA Corporation’s (NVDA) Growth Drivers,Yahoo,https://finnhub.io/api/news?id=de707b932dbcc44cad63d5dd8339c31f8bde0de0f657bbec40455c03e1dc647f
NVDA,2025-12-04 13:34:47,"CoreWeave, Inc. (CRWV): A Bull Case Theory",Yahoo,https://finnhub.io/api/news?id=ad2b618dc407dfaff7f3833776f45e731d1a6f06f63b7404ebecee2bf5c8d1ee
NVDA,2025-12-04 13:20:00,Could This AI Chipmaker Be the Market's Next Trillion-Dollar Contender?,Yahoo,https://finnhub.io/api/news?id=5280152ab73eef240a726a2336e1b84615886fe1a54a5dfc544e31505a9fd881
NVDA,2025-12-04 13:18:28,"Meta faces EU probe, Palantir's software deal & Salesforce results",Yahoo,https://finnhub.io/api/news?id=88b2c54aeb43ead10008ed505358f19fea8f68258cd8563a702930f22e00ce73
NVDA,2025-12-04 13:11:57,Nvidia Stock in Focus -- U.S. Lawmakers Exclude GAIN AI Export Limits,Yahoo,https://finnhub.io/api/news?id=74ce9c6f340762984c28b79bd9261a26fc7e8d7c16de64ebf50edf5f213298fb
NVDA,2025-12-04 13:10:00,Micron Stock Drops After Company Dumps ‘Crucial’ Business,Yahoo,https://finnhub.io/api/news?id=be7ca53c28ec799f1c754bfa4e8ec6375b6f9d8777a9b118cc5c934a8f3b885a
NVDA,2025-12-04 13:01:00,The ‘Neocloud’ Crash Might Be a Buying Opportunity. How CoreWeave Stacks Up.,Yahoo,https://finnhub.io/api/news?id=d4429036e70ee29b75de0fb66ede3da7d1894df50664e03db333d66760e11afc
NVDA,2025-12-04 13:00:49,"Nvidia, Palantir Snubbed, But Top Funds Get Googly-Eyed Over This AI Stock",Yahoo,https://finnhub.io/api/news?id=7a50734becdff0937b35a1730f97db7c60ab2f28bca982ae2f45ec94003d7fb0
NVDA,2025-12-04 13:00:42,Nvidia CEO breaks down the 'layers' of AI & how they work together,Yahoo,https://finnhub.io/api/news?id=12f04b35a95dbe5f9e11f81c7b626de251d5989717093b4fc016daa6bcc4048b
NVDA,2025-12-04 12:35:00,2 Top AI Stocks to Buy in December,Yahoo,https://finnhub.io/api/news?id=f03efd9b50520f1335ba421ed396c9dbdf19883f162514b96c1d2bbedc338aa2
NVDA,2025-12-04 12:20:00,Why This AI Winner Might Be Just Getting Started,Yahoo,https://finnhub.io/api/news?id=e66955e9db4386b82129e81d371c80d71a817e828ca9b7c2e5ed56c9edccefcc
NVDA,2025-12-04 12:05:23,Better for national security to not sell Nvidia chips to China: CSIS's Allen,CNBC,https://finnhub.io/api/news?id=8ea79d139e5e3572aa07a98ac51d506aa59ab700a9154535f482191d32e348f4
NVDA,2025-12-04 11:57:00,Tech Basel Miami AI Summit Draws 400+ for Sold-Out Gathering of Global AI and Emerging Tech Leaders,Yahoo,https://finnhub.io/api/news?id=07b46b082045ca1de52b2c022e1fcf9247e4ab09b3da131af6d6a30783db4c1f
NVDA,2025-12-04 11:25:01,Google taps AI vibe-coder Replit in challenge to Anthropic and Cursor,CNBC,https://finnhub.io/api/news?id=1d82755da534d428f4b61462c5533c4d2c875c6d3361c3b876e23d6a478432f4
NVDA,2025-12-04 10:00:21,NVDL: Better Safe Than Sorry,SeekingAlpha,https://finnhub.io/api/news?id=e64d619ec6144bf171569e36bf3b9965035680a903814982ad4362dcd62ab3cb
NVDA,2025-12-04 09:49:00,"Investing in Artificial Intelligence (AI) Can Be Risky, but Here's a Magnificent Way to Do It",Yahoo,https://finnhub.io/api/news?id=64e6ca9b709bb6ba636e154644437527232e6faee837cb40ae961bd67e77bbf0
NVDA,2025-12-04 09:31:36,"Palantir teams with Nvidia, CenterPoint Energy for software to speed up AI data center construction",Yahoo,https://finnhub.io/api/news?id=5ca43f9219a536056f3a099676be45f7c181affec3eba403c4cd65e9c52c3380
NVDA,2025-12-04 09:30:52,Alphabet: Something Doesn't Add Up,SeekingAlpha,https://finnhub.io/api/news?id=d5cd73513b6f2df053242fb90abea6f3cb9a95d79580cbc62e781e0d9d6800c6
NVDA,2025-12-04 09:30:00,Palantir Launches Chain Reaction to Build American AI Infrastructure; Founding Partners Include CenterPoint Energy and NVIDIA,Yahoo,https://finnhub.io/api/news?id=106e0956fdff3e12cd9c1355fc718bb47dcb81d9adb50e37d6c48c6e5a4eabfa
NVDA,2025-12-04 09:15:00,Think You Can Hide From The AI Bubble? Think Twice,SeekingAlpha,https://finnhub.io/api/news?id=d53bff00b5309e6aa3765ad51b691e85e151e081f4ea5ea57f4faea99984cc50
NVDA,2025-12-04 09:11:00,Is Palantir Going to Plunge 50% (or More) in 2026? History Offers a Very Big Clue.,Yahoo,https://finnhub.io/api/news?id=a9e888836c83fdf66d8a532e3a42830f48abcdf74e3aa6ee62ac0b74f789bef8
NVDA,2025-12-04 09:00:00,Alphabet: The Easy Money Has Been Made (Rating Downgrade),SeekingAlpha,https://finnhub.io/api/news?id=ed3d7da42761e1651895008641cd51ded2ab3cfa10574add7d1f0ef6794d3529
NVDA,2025-12-04 09:00:00,Marvell Is Still Mispriced. Buy Before Wall Street Wakes Up,SeekingAlpha,https://finnhub.io/api/news?id=5017781376c694ba5f89389e8495493e3eaf431a42c21a6ceeb5936b3923d815
NVDA,2025-12-04 08:35:00,Could This Be the Safest Way to Invest in AI Without Touching Chip Stocks?,Yahoo,https://finnhub.io/api/news?id=2442a54a119af599a16dd0c7e54aa97d53ab87da034a3f826d11b8b53727eab6
NVDA,2025-12-04 08:05:26,"Weak jobs data, Salesforce earnings, GM's 'Silicon Valley cowboy' and more in Morning Squawk",CNBC,https://finnhub.io/api/news?id=c35afcd9bf002d41fa4be1627f61d05e60a9bd7c9bb8dc564454bb5d074b9d18
NVDA,2025-12-04 08:00:00,Traefik Labs Joins HPE Unleash AI Partner Program to Deliver Sovereign AI Infrastructure with Triple Gate Security Architecture,Yahoo,https://finnhub.io/api/news?id=49a2889271ffc22efc475c4ab80f4a1f44ac965792e82ca515da98dcb3953242
NVDA,2025-12-04 07:18:37,Wall Street Breakfast Podcast: Jensen Huang Getting The Hang Of DC,SeekingAlpha,https://finnhub.io/api/news?id=9f5ddce0d618aa47aca6032ed3672bdddb3f7d2427fac1bf0457ed28bb3b0367
NVDA,2025-12-04 07:00:00,Fortanix Teams with HPE and NVIDIA to Embed Confidential Computing in AI Factories,Yahoo,https://finnhub.io/api/news?id=04f47800631d79c44ae89f8b00e0441780c1eedcfe921719394be81399e95a2e
NVDA,2025-12-04 06:34:41,"Today's Market: Dow Rises, Nasdaq Climb Despite Microsoft Sparks Fresh AI Selloff",Yahoo,https://finnhub.io/api/news?id=3990030836d119feed2f80bbd32c2ff18194ecda803b735861b1ffc938a66f17
NVDA,2025-12-04 06:20:00,Trillion Dollar Market Caps: Fairy Tale Pricing Or Business Marvels?,SeekingAlpha,https://finnhub.io/api/news?id=ace0ad23d2482e100bfeace4954513b3f91e5c411d7c577604b7863d10a5c85b
NVDA,2025-12-04 06:00:10,Most popular stocks and funds investors bought in November,Yahoo,https://finnhub.io/api/news?id=c571bdb72fd5d9579f1b780e61b6067622da269984642033b863489379806a7b
NVDA,2025-12-04 05:37:37,Trump praises Nvidia's Huang after talks on chip export controls,Yahoo,https://finnhub.io/api/news?id=d84741d0fc784494f8b6de4ff9542b59f9e2b6cdc70c6e1f6f2ba319229c5716
NVDA,2025-12-04 05:05:07,"Jim Cramer Says “Once again, I Say Own NVIDIA, Don’t Trade It”",Yahoo,https://finnhub.io/api/news?id=fcee83ee55a5905ecbbe43baba86828e0f595ded050f5df18221f46dc37eaa23
NVDA,2025-12-04 05:04:44,Jim Cramer Highlights NVIDIA’s Deal With Synopsys,Yahoo,https://finnhub.io/api/news?id=818ab6aff79043da4e38b2427f85ca7811930fa0dc5c7b67c59f37635c4f2ff3
NVDA,2025-12-04 04:37:49,NVDY ETF: Weekly Payouts Likely To Decrease,SeekingAlpha,https://finnhub.io/api/news?id=9e4e7c8105ed9af5ce1b48f040a6c68589890bd6f6342b3a193921a6e6a0ea21
NVDA,2025-12-04 01:37:00,Bank of America resets Amazon stock forecast after key meeting,Yahoo,https://finnhub.io/api/news?id=101f8ca573c3bcd7726d4cbcb77dde50392e09be029319f6f45cfdb738683daf
NVDA,2025-12-04 00:44:09,Nvidia: Why Its Lead Over Competitors May Be As Short As One Year,SeekingAlpha,https://finnhub.io/api/news?id=e700cf4c7599f599a37f97b9632777f40c7bba2581eb7b26b73f165586334950
NVDA,2025-12-04 00:40:43,Nvidia CEO Jensen Huang visits Republicans as debate over intensifying AI race rages,Yahoo,https://finnhub.io/api/news?id=b5039fcc8f01a1eafb6cc08fbff0af756eca20026dac8025620c0f14088857ad
NVDA,2025-12-04 00:35:00,Is Palantir's Deal With Nvidia a Game Changer?,Yahoo,https://finnhub.io/api/news?id=564cef6bc2b385bf959da993dfd9194684c7d8b8122b6ba70ed2b9abad02582d
NVDA,2025-12-04 00:05:00,"Nvidia CEO talks China's importance, how 'formidable' Huawei is",Yahoo,https://finnhub.io/api/news?id=a6abe7025fe02d9f178ab63dd6332bb714fb7c0e7e29c2a0212523e8dd797567
NVDA,2025-12-03 23:26:23,Nvidia’s Huang Unsure Whether China Would Accept H200 Chips,Yahoo,https://finnhub.io/api/news?id=71c1dbd603d6fe2d5ba7f96884b51da266d423f491c29fbe99f2393a00b55838
NVDA,2025-12-03 23:13:00,Buy the Spike in Marvell Technology Stock After Q3 Earnings?,Yahoo,https://finnhub.io/api/news?id=75e1529c1a22cdf7ffce54336a1fa2cdd78f21f2e1f183af94921b654126fdcc
NVDA,2025-12-03 23:09:50,Nvidia's CEO says this is one of the 'greatest things' Trump has done,Yahoo,https://finnhub.io/api/news?id=17bff599d9691ceeee0aa1191e03daa234178ae592df06455b6421d5915517e9
NVDA,2025-12-03 23:07:54,SCHD ETF Alternative Strategy Aimed For Higher Total Return,SeekingAlpha,https://finnhub.io/api/news?id=c017a105b901f94983ddecbb010e4c5c7e370bb1ce5cba3a64441da8f18c95b6
NVDA,2025-12-03 22:37:38,"Anthropic CEO: Some AI companies ‘YOLOing,’ pulling the ‘risk dial too far’",Yahoo,https://finnhub.io/api/news?id=c8a62d37f489b45b918c2d29cb2142a2670c223289556ff8c927a56ee44f2531
NVDA,2025-12-03 22:28:51,"Synopsys: Steady Expansion, Premium Price, And Market Expectations Priced In",SeekingAlpha,https://finnhub.io/api/news?id=8634d741d195771f7dc1741ea7a50f5016effa931c443238a39ad366e9bdc3f2
NVDA,2025-12-03 17:33:20,Nvidia servers speed up AI models from China's Moonshoot AI and others tenfold,Yahoo,https://finnhub.io/api/news?id=f5e6304df82d10f3c0828faaeb18b3812c7015595f58b7491d796bbbd9c873d8
