symbol,datetime,headline,source,url
GOOG,2025-12-04 06:36:59,Microsoft Stock Falls Amid Slow Corporate Adoption of AI Solutions,Yahoo,https://finnhub.io/api/news?id=c9233960b5a9fa80276db1759feb6eeae545c6f49c87cf740057e945adc99036
GOOG,2025-12-04 05:25:46,CNBC's Inside India newsletter: How a government app in India triggered a backlash over internet freedom,CNBC,https://finnhub.io/api/news?id=9c6c79065989995b4f1fbe1a8833d7aff5c2298e66cf4e3401286776192fef1e
GOOG,2025-12-04 05:20:03,Meta faces Europe antitrust investigation over WhatsApp AI policy,CNBC,https://finnhub.io/api/news?id=7af7b7c4cb671d2114c25133d6009bf07597b7b5b005f5421d02e89e2926c845
GOOG,2025-12-04 05:11:17,Does 300 MW Fluidstack AI Lease And Google Backstop Transform The Bull Case For Cipher Mining (CIFR)?,Yahoo,https://finnhub.io/api/news?id=25fe4be7f58587eaf63523056eab9710912fa7d07bef510f629d0e6dd1fbba05
GOOG,2025-12-04 05:05:06,Jim Cramer Notes That “The Gemini 3 Improvement Was Very Good News for Google”,Yahoo,https://finnhub.io/api/news?id=a1f7db1f842d885b0a63ccfae5a45ef8075ad58dfce845a17ecc54ced936912d
GOOG,2025-12-04 05:00:29,EU to launch antitrust probe into Meta over use of AI in WhatsApp,Yahoo,https://finnhub.io/api/news?id=3a066bcc506538a109a1981dcad6a3ff0b700807f2daddafe216dec25f90eea9
GOOG,2025-12-04 03:03:00,Analyst who bought Palantir below $10 revamps stock price target,Yahoo,https://finnhub.io/api/news?id=13c55501d6e5f59ec915ed7e8b25ba2a17aa3e2cfe7087978759b0d653bf2b33
GOOG,2025-12-04 02:01:14,"'Just Beginning,' Awardco Founder On The Superpower That Allowed Him To Build A $1 Billion Business",Yahoo,https://finnhub.io/api/news?id=20b91770c04d46b2740404d63b9756c64d9559f8b2e1bee352d8da428a6fa4cd
GOOG,2025-12-04 00:53:00,Global Dealer Solutions Highlights the Growing Importance of Auto Dealer Local Search Marketing,Yahoo,https://finnhub.io/api/news?id=ebadd3f9fd33660086c528c8e037029ccad7f48f644bdac89662c11d8da822e3
GOOG,2025-12-04 00:44:09,Nvidia: Why Its Lead Over Competitors May Be As Short As One Year,SeekingAlpha,https://finnhub.io/api/news?id=e700cf4c7599f599a37f97b9632777f40c7bba2581eb7b26b73f165586334950
GOOG,2025-12-03 23:31:16,He Reached His FIRE Goal After Years Of Sacrifice. Now Inflation Is Forcing Him To Rethink Everything. 'That $40k Budget? It's Now $55k',Yahoo,https://finnhub.io/api/news?id=4385b17820bc03ff8171511f077f30b6aaee5cbb264f3930ff3f1b0ff43ce18c
GOOG,2025-12-03 23:15:12,How Investors Are Reacting To Alphabet (GOOGL) Nest Lawsuit Challenging Smart-Home Reliability And Trust,Yahoo,https://finnhub.io/api/news?id=f6f83001bded081306fc450158572763872fd1c5d270fe6eaffed42babe098a0
GOOG,2025-12-03 22:37:38,"Anthropic CEO: Some AI companies ‘YOLOing,’ pulling the ‘risk dial too far’",Yahoo,https://finnhub.io/api/news?id=c8a62d37f489b45b918c2d29cb2142a2670c223289556ff8c927a56ee44f2531
GOOG,2025-12-03 22:33:00,Morgan Stanley drops eye-popping price target on Nvidia stock,Yahoo,https://finnhub.io/api/news?id=c23f8cb270219dc6de679f4c83f7ecb1bf917e0aa1b8b3f091938213acb5f2e3
GOOG,2025-12-03 22:03:46,"Tracking Ruane, Cunniff, & Goldfarb's Portfolio - Q3 2025 Update",SeekingAlpha,https://finnhub.io/api/news?id=45bdbc50708f30c2a49160c2d48dfda6ad414650e006f7f227011766041541a7
GOOG,2025-12-03 22:01:10,EXCLUSIVE: Acorns CEO Noah Kerner Shares How Gen Z Can Build Smart Money Habits And Ease Their Financial Anxiety,Yahoo,https://finnhub.io/api/news?id=6e12390c1eb5963186e09faf1afd91f2425b05e5769f0dcd7db1cf513dabdca4
GOOG,2025-12-03 21:58:44,"Walmart Stock Rallies, Pushing Market Cap Above $900 Billion",Yahoo,https://finnhub.io/api/news?id=eb40673094d3dd4562cdfe52f4f41a2bc39b34be91f39af1fa416f82d4ac32d0
GOOG,2025-12-03 21:45:00,AI investing has entered a 'new phase': Strategist on tailwinds,Yahoo,https://finnhub.io/api/news?id=5655a888cd56c3c76574653cb4a9c7d11d27ec798a4558602e5b74f9089f96dc
GOOG,2025-12-03 21:10:00,UiPath Reports Third Quarter Fiscal 2026 Financial Results,Yahoo,https://finnhub.io/api/news?id=55e7ff737ddd49412de2d231a4f5531635456b0855dcaad9589ccf0568419f0d
GOOG,2025-12-03 18:06:43,"Alphabet: Gemini 3 Changes Everything, And The Market Knows It",SeekingAlpha,https://finnhub.io/api/news?id=b354ab1cea9d846200e01cc59e70a13b2e065aaa147c60852de609e2455b4225
GOOG,2025-12-03 17:57:49,A Major Market Disconnect Is Forming,SeekingAlpha,https://finnhub.io/api/news?id=36a1f8f222ca12dba4e0ad27737c32d1edcce8aff4ec0234ea87d9e4873f9b4b
GOOG,2025-12-03 17:27:36,Will Google TPUs dethrone Nvidia?,Yahoo,https://finnhub.io/api/news?id=d4f9e49f31431b4f5e5a878078e1029e5ae0b0f68836670e9c5de3c811e27c1f
GOOG,2025-12-03 17:07:00,"Hawkeye Land Company, Inc. and Anderson Pacific Capital, LLC Announce Formation of Midwest FiberPath, LLC to Develop State-of-the-Art Fiber Infrastructure",Yahoo,https://finnhub.io/api/news?id=616dfaa52364f04cfa6d5e98dd5d14f8735eb421f479a874fd5e3ab6e188259c
GOOG,2025-12-03 17:05:52,Google Has Changed From Buy To Hold,SeekingAlpha,https://finnhub.io/api/news?id=be90db981c29217f138a0e32f4e0d72cc3bfe61005bb694f71ca5c15fbc2b9ca
GOOG,2025-12-03 17:04:41,"Forget Palantir, another AI stock is up 180% in 2025",Yahoo,https://finnhub.io/api/news?id=c176b317fb4a0dfe5a95c47fdfe8ffb46672cff9788b1def41c2b4875f979cf3
GOOG,2025-12-03 17:01:11,"Former Salesforce Co-CEO Bret Taylor's Startup Sierra Hits $100M ARR, Powers 95% Of Black Friday Shoppers",Yahoo,https://finnhub.io/api/news?id=24736bf4a40f600206a5a13d2bebec87e41c9063462bed44999bd8b5d9addcb3
GOOG,2025-12-03 16:51:25,"Not a 'bubble,' but maybe an 'air pocket': Wall Street says it's time to reset the AI narrative",Yahoo,https://finnhub.io/api/news?id=65b29b3c29743c3867a62ba3f74781748b47a3457056dc93a6b704d57b44ba90
GOOG,2025-12-03 16:12:51,Trump admin. 'acting with urgency' with xLight stake: Pat Gelsinger,Yahoo,https://finnhub.io/api/news?id=194c95f2c5816c8716c03a3d404d3c5dec141451ce0ed07465328e08a4ceae2a
GOOG,2025-12-03 16:11:29,"Alphabet Has Everything Meta, Microsoft, And OpenAI Lack",SeekingAlpha,https://finnhub.io/api/news?id=e629834fd50040b71041d1709ab1568e4e3217a19dc3d37fa93cbefcabdd9dac
GOOG,2025-12-03 16:09:55,Amazon Details Cloud AI Game Plan. Why Its Stock Could Be 'Different AI Winner.',Yahoo,https://finnhub.io/api/news?id=18863237271a6df4b530b34f29dd15aa80ff1f70b2f5ae6bca7d0b89fe43e550
GOOG,2025-12-03 16:00:00,Xfinity Empowers the Next Generation of Innovators at the 4th Annual STEAM Symposium at Universal Orlando Resort,Yahoo,https://finnhub.io/api/news?id=49f22685b4ef964a16f7710749161ee33ed5980e3c6618285e74f143712cc6b8
GOOG,2025-12-03 15:45:35,"AI Infrastructure Races Will Be 'Intense' In 2026, Says Google Executive. 'We Must Double Every Six Months.'",Yahoo,https://finnhub.io/api/news?id=aa511aa163528e3aa51030caefeda6ee8390ca97b833fbe6dbb751c513136530
GOOG,2025-12-03 15:32:51,"AI race's new contenders, ADP reports loss of 32K jobs in November",Yahoo,https://finnhub.io/api/news?id=558b6fdaef6e4cf612272cee97a342b93809611cc09343f799513c424d96bd04
GOOG,2025-12-03 15:32:24,Microsoft Stock Slips On Report Customers Resisting AI Products,Yahoo,https://finnhub.io/api/news?id=35e5f3ae79b8212a39841505a692d061da6305dcc9a7a13e83106459ab25201c
GOOG,2025-12-03 15:02:39,Market is shifting from AI winners to 'AI enablers': Strategist,Yahoo,https://finnhub.io/api/news?id=390f47679762ef565ac2d90f2fd8e26279f8d3c70327a4a818698aebde9b5d39
GOOG,2025-12-03 15:00:00,"G2 Publishes New Winter 2026 Reports, Highlighting Software Leaders and Category Growth",Yahoo,https://finnhub.io/api/news?id=c8019459659deee0913bddb81ed29bd0144ae87860015d6225151a1bc726f0c5
GOOG,2025-12-03 15:00:00,Gemini vs. Copilot: Which Tech Giant Will See Revenue Jump 100% First?,Yahoo,https://finnhub.io/api/news?id=c450d3a0f0c4884519cdc0bd8a70d963a130dab53123d7c5c5dac3458c176803
GOOG,2025-12-03 14:53:00,The Most Important Artificial Intelligence Trend No One Is Talking About,Yahoo,https://finnhub.io/api/news?id=38f33f3e2eff5f035508cea6a1f936b0179dab8551ba49eafac7ce2a7c02522f
GOOG,2025-12-03 14:46:36,Microsoft stock falls on reported AI sales quota cut,Yahoo,https://finnhub.io/api/news?id=9ec06524ae21a37770f3d783ad5b27ad83bfc39384d445e19c07b51e842a5ae7
GOOG,2025-12-03 14:46:00,"Pattern Announces Acquisition of ROI Hunter, Connecting Product-Level Advertising and Marketplace Performance for Global Brands",Yahoo,https://finnhub.io/api/news?id=acd535fe983123085046d37f94bc03bcc81768d9427814bfd84453dccd9a312c
GOOG,2025-12-03 14:42:02,OpenAI Slams the Panic Button as Google Heats Up the AI War,Yahoo,https://finnhub.io/api/news?id=264a8c8ca2d5f2c0a9cf8bcd069cfc3a265de3e8414c760362731959e1381b42
GOOG,2025-12-03 14:41:13,Salesforce’s Stock Is Historically Cheap as AI Risk Takes a Toll,Yahoo,https://finnhub.io/api/news?id=e82089b02550ae7d3cf54c07dfd3464936f2441542659eaf82e10af4ae7a9c19
GOOG,2025-12-03 14:15:31,"Microsoft lowers AI software sales quota as customers resist new products, The Information reports",Yahoo,https://finnhub.io/api/news?id=d54cfe0d206b236bf3b5916787c5f81a6f96ca343b78b5ea5c452506688efb4a
GOOG,2025-12-03 14:15:00,AI Neo-Insurer MGT Adds Senior Leaders from Google and High-Growth Tech Startups to Scale Operations and Drive Growth,Yahoo,https://finnhub.io/api/news?id=472e67851e0f04823afce0efc9d517881606e372ae943e24f2d89726bef6fa00
GOOG,2025-12-03 14:08:15,"Alphabet's AI, ADP job data, Macy's & Dollar Tree: 3 Things",Yahoo,https://finnhub.io/api/news?id=268b986dfa0bed010fec53d78c9526e0cb1c017ff54e99a945045a6a57da065b
GOOG,2025-12-03 14:01:05,Better-Than-Expected Trends Lifted Alphabet (GOOG) in Q3,Yahoo,https://finnhub.io/api/news?id=5bf8f4f0e1caa85f4aabdc2d5845f706f303b3c0caf5b1c0ce305cde8e50cfd1
GOOG,2025-12-03 14:00:00,"Vaudit Surpasses $1 Billion in Digital Ads Audited in 2025 and $100 Million in Refunds Processed for Global Brands Including Accenture, HP, Panasonic, and Volkswagen",Yahoo,https://finnhub.io/api/news?id=bf07831191364a2935a283e17ba4dd66694021fb6f7e25e839490b2edc5f5809
GOOG,2025-12-03 14:00:00,Ridley Raises $6.4 Million Seed Round to Rebuild the Real Estate Industry Around Consumers,Yahoo,https://finnhub.io/api/news?id=66f19ba9d3257b803a88e108a6984590d3f417b968a269a7523c496881abe9da
GOOG,2025-12-03 14:00:00,Roundhill Investments Launches UNH WeeklyPay™ ETF (Ticker: UNHW),Yahoo,https://finnhub.io/api/news?id=fa11a373583deff4e1f8794e3f8580b6197e1ed3404174f3b3aadcde002e3c56
GOOG,2025-12-03 13:30:02,Here's How Much You'd Have If You Invested $1000 in Alphabet a Decade Ago,Yahoo,https://finnhub.io/api/news?id=713c436d8a659665ace4d23508e16ae734662d66de0325331fb372fcd6b05400
GOOG,2025-12-03 13:25:33,What OpenAI's 'Code Red' Means For The Markets,SeekingAlpha,https://finnhub.io/api/news?id=0ad82f2bdacfd58a2b569a70e683b216e8d6272a710f7e75a68af7f7d103501f
GOOG,2025-12-03 13:01:03,"If You Invested $10K In GameStop Stock 10 Years Ago, How Much Would You Have Now?",Yahoo,https://finnhub.io/api/news?id=33f7584e203edf9d4a254308f35d6785be35093c74679e6bf341f216725f146f
GOOG,2025-12-03 13:00:41,"AppLovin Stock Rides Swarm Of Setups Beyond Just Mining, Medical Names",Yahoo,https://finnhub.io/api/news?id=df6992ab7d1466f349189f3b59afbad34794bbfbd8c16cbe42c4304a2cbd1cab
GOOG,2025-12-03 13:00:00,3 Red-Hot Growth Stocks to Buy in 2025,Yahoo,https://finnhub.io/api/news?id=241bd1963ebd8136bfad4ec167ed4380d8c71e05362c0d92a4447532ecb0b79e
GOOG,2025-12-03 13:00:00,"NTT DATA signs agreement to acquire SPRO, strengthening its capabilities in SAP for agribusiness in Brazil",Yahoo,https://finnhub.io/api/news?id=f52a5a03ea85d08452b8f52982f8121d6c5c99a7205149f3b83a752e899103f8
GOOG,2025-12-03 11:50:06,Pressure growing on the AI Agent narrative,CNBC,https://finnhub.io/api/news?id=c037343a502b1b73e9691ff040207cff39b04b8634c50c66ae6c0dd8adb2f011
GOOG,2025-12-03 11:45:24,Power supply more likely to constrain AI than semiconductors: Former OpenAI executive Zack Kass,CNBC,https://finnhub.io/api/news?id=49e348bd814bebb824d390307a58d1c47957744f68d5cdc9789828fca7fe7f6d
GOOG,2025-12-03 11:01:53,Meta: The Next Google (Rating Upgrade),SeekingAlpha,https://finnhub.io/api/news?id=97bf1fe66c3e6d97c73637a2ffa57b80b19bb4a6c2327067c981fedec20e96c8
GOOG,2025-12-03 10:03:36,Microsoft stock sinks on report AI product sales are missing growth goals,CNBC,https://finnhub.io/api/news?id=cf2a21748c6e2e1fad57da11354e5bb41836ee48ac5585de203d37c0436848f3
GOOG,2025-12-03 09:10:00,"AI Won't Kill Adobe, Here's Why",SeekingAlpha,https://finnhub.io/api/news?id=3156e0087f7caadde0bc1add45e9391a73b13164ea82498e641b963711a56dc8
GOOG,2025-12-03 07:30:00,My 3 Big Market Predictions For 2026: The Shift I'm Positioning For Now,SeekingAlpha,https://finnhub.io/api/news?id=1c6bea9a3148f091f96ea96db25efab9a96aa4037bdd87c51a103ce3118aafce
GOOG,2025-12-03 06:58:03,Wall Street Breakfast Podcast: Nike Makes Big 'Sport Offense' Roster Moves,SeekingAlpha,https://finnhub.io/api/news?id=0a1215d3038497afea5ac5fb562d83e383c2b4a8c79895236e9a76bd89f9d04c
GOOG,2025-12-03 06:38:15,"Google's lawsuit, Kalshi's latest valuation, Eventbrite's exit: Stock Market News",Yahoo,https://finnhub.io/api/news?id=c8efb8e2b761981fe71adfdc962491d7a0e627121301bc36a580f7913465e75b
GOOG,2025-12-03 05:37:00,Here's Why the Next Phase of the AI Boom May Not Come From Chipmakers,Yahoo,https://finnhub.io/api/news?id=6153ffeb19b4b0f827314f687b609add2f573ebd1cac3a675d73c6fc37f43226
GOOG,2025-12-03 05:30:00,Nvidia’s Fat Margins Are Google and AMD’s Opportunity,DowJones,https://finnhub.io/api/news?id=47210bb715de4c9cdfad02cbb5d938e047744616314e53f5539875933b783b27
GOOG,2025-12-03 04:07:00,Waymo vehicle commits dangerous error in viral video,Yahoo,https://finnhub.io/api/news?id=4b48f3658a31589ded3e3716e80c24d9be5722a6767e2743a90f9fa19c521bf8
GOOG,2025-12-03 02:30:00,Kioxia and Google Collaborate to Boost Clean Energy Use in Japan,Yahoo,https://finnhub.io/api/news?id=9a4c5a09fff376815cf25c0ebe5c26d688596010d53f6e12f7ca7f81431f3e52
GOOG,2025-12-03 02:10:00,"Alphabet, Amazon And Microsoft Charge Ahead On AI Capacity Build-Outs",SeekingAlpha,https://finnhub.io/api/news?id=a555c22a66ad0edd2077eae77cb9c6d2a547a6f227bec611799f1b46c5b402fd
GOOG,2025-12-03 01:30:35,Jim Cramer Says 'Only A Matter Of Time' Before OpenAI Admits Falling 'Behind' Google Gemini 3 As Sam Altman Reportedly Hits 'Code Red',Yahoo,https://finnhub.io/api/news?id=56f356c2f93fea51a70d6c20cd09992f8858a6f6ccc081d902f2862cd368857e
GOOG,2025-12-03 01:00:09,AI Takes Over? 'Final Fantasy' Maker's Bold—and Risky—Reboot Signals New Era For Video Games: 'An Extremely Difficult Decision',Yahoo,https://finnhub.io/api/news?id=a39d7672a676013f211a039d3be9885f5a92c1b0ec3345ef64650fd8318bd2b7
GOOG,2025-12-03 01:00:00,"Disney, Big Tech Take Up Energy Trading As Power Costs Soar",Yahoo,https://finnhub.io/api/news?id=f5d811429d1f1369d835d34fd8a1bd7f5813a829079314fff01f6e70dab6c298
GOOG,2025-12-03 00:55:55,"Netflix, Warner Bros Discovery combo seen lowering costs for consumers, sources say",Yahoo,https://finnhub.io/api/news?id=8a690b690a26c8660abc0326f755af24da6935703c60529ec7659df0988d84d2
GOOG,2025-12-03 00:51:00,Apple’s AI Troubles Are Fading. Just Look at the Stock.,Yahoo,https://finnhub.io/api/news?id=717e55d18f2a73a94a97185e070393e90649ec27405c690a111dd556debd4e01
GOOG,2025-12-03 00:48:54,"Anthropic plans an IPO as early as 2026, FT reports",Yahoo,https://finnhub.io/api/news?id=d82426a4a2d9c736dc007e0bc66c001eef1dcb0ea5f378c399982be5efe7cd07
GOOG,2025-12-02 22:50:31,"Stocks to Watch Tuesday Recap: Warner Bros., Marvell, MongoDB, Ford",Yahoo,https://finnhub.io/api/news?id=a0aed33dd3f821987573f5d9427f9f1ce620d5df24a17e85dd82e69adb8438e7
GOOG,2025-12-02 21:58:01,"Nasdaq Hits 3-Week High Amid Tech Boost; Boeing Lifts Dow, S&P 500",Yahoo,https://finnhub.io/api/news?id=815922de014742d6ce5e0cc316c47eb6ae689214e5b0d5799254a5f0025ca8a0
GOOG,2025-12-02 21:01:25,"Beta inks $1B deal with Eve Air Mobility, Estée Lauder's AI chatbot",Yahoo,https://finnhub.io/api/news?id=cf525aaa001d23d0998fd3293da2d4c50ac7a1f39656650423ed6335d7fe2c2c
GOOG,2025-12-02 20:12:00,"The 3 Best Magnificent 7 Stocks for 2026 (GOOGL, AAPL, TSLA)",Yahoo,https://finnhub.io/api/news?id=c20bc16b4f28d2efe8f7f1c155f0a6d4922c4be4919a46136390a7c38b038fe1
GOOG,2025-12-02 20:09:13,How Recent AI Partnerships and Analyst Sentiment Are Changing the Broadcom Investment Story,Yahoo,https://finnhub.io/api/news?id=04f6a0b962beb0cebacccb6a78799b6dfaeb4ab90ab3e0568e3844a4fadd371d
GOOG,2025-12-02 19:23:02,How Micron Stock Could Be an Even Bigger Winner Than GOOGL from a Google-Meta Deal,Yahoo,https://finnhub.io/api/news?id=d0842df1329e1ab37a57c7575dc00afefcac4ecfaeea590c5ecb31b383ed6fb2
GOOG,2025-12-02 19:17:00,Amazon Is Taking On Nvidia and Google. Why It’s a Big Deal for the Stock.,Yahoo,https://finnhub.io/api/news?id=fe67127101c3adf4d796c6ba6ecfe8cb4294671d756a4fbe151d3acfa8d2c3ac
GOOG,2025-12-02 19:05:03,Equity Markets Rise Intraday Amid Tech Boost; Boeing Jumps,Yahoo,https://finnhub.io/api/news?id=205ddd843a74e2af42ddcb2dff56f05c27713d471288d5c8fff8df9f325849d9
GOOG,2025-12-02 16:52:52,Where The Markets Stand Heading Into 2026,SeekingAlpha,https://finnhub.io/api/news?id=4b0e074621240cfe1a97f2a6a6fac5f18b0100791ab4b458eb835715342e3d06
GOOG,2025-12-02 16:23:49,Alphabet: Buy And Hold Like Berkshire Hathaway,SeekingAlpha,https://finnhub.io/api/news?id=b247e5c36872d5c2051217b0c114bcf7ea7ac3ae231be20ef99853502cf45532
GOOG,2025-12-02 14:17:51,OpenAI CEO Sam Altman declares 'code red' as ChatGPT competition mounts,Yahoo,https://finnhub.io/api/news?id=bca18de3e95a0c3e5a6df8355e6c56df35f9d9601cb81dece5da7aa454145d1c
GOOG,2025-12-02 13:46:00,Maropost welcomes elite advisory board members to drive global expansion,Yahoo,https://finnhub.io/api/news?id=e7bb4cac1c621cfbf2ceec783a7d56d7c3235f0b3fb98d5d052ec10d6be29eb7
GOOG,2025-12-02 13:42:00,"As AI Data Center Demand Surges, Taiwan Semiconductor Manufacturing Could Be the Biggest Long-Term Beneficiary",Yahoo,https://finnhub.io/api/news?id=1ebc6adadfcf9b702af4acfbef0e282395cf00a178cb91f9db9b7b5fdf7784c6
GOOG,2025-12-02 13:36:31,"Stocks to Watch Tuesday: Warner Bros., MongoDB, Credo",Yahoo,https://finnhub.io/api/news?id=491a5c5f50ebf96d229c0a926a5c66506ec709f6c53ea2c917403c2e75caa14c
GOOG,2025-12-02 13:30:20,"Netlist says USPTO, DOJ file public interest comment in ITC action",Yahoo,https://finnhub.io/api/news?id=1e73acedbc5f5c7895eeec260a756c489f52ce9bded18291e1866c37ec76057f
GOOG,2025-12-02 13:30:00,"3 No-Brainer Stocks to Buy With $1,000 and Hold Forever",Yahoo,https://finnhub.io/api/news?id=51b9c3566e57f6ba99010020f9a9654ca4a6cab7784ebc20cf6c57ae275dfedc
GOOG,2025-12-02 13:11:00,Nvidia Stock Is Rising. How It’s Taking the Fight to Google.,Yahoo,https://finnhub.io/api/news?id=abb91685f51c073bec920defed6f23a9b4bec21df8d85c5ad6be6af301e2e3a0
GOOG,2025-12-02 13:10:00,"mHealth Market Growth Opportunities and Investment Prospects 2025-2030, Featuring Medtronic, Apple, Samsung, Google, Philips and More",Yahoo,https://finnhub.io/api/news?id=71e0108c2fcf1914d07126531668f2cbb20fa0efc5333e37b9d9e57aae9f262a
GOOG,2025-12-02 13:02:57,Heartland Opportunistic Value Equity Strategy: Alphabet (GOOGL) is a Winner — Not A Laggard — When It Comes To AI,Yahoo,https://finnhub.io/api/news?id=18941d9177984c8cd571b908a68238ef60db6ddbf6c075ed227de073245b9921
GOOG,2025-12-02 12:59:16,Wall Street Lunch: OpenAI To Develop LLM 'Garlic' To Counter Google's AI Gains,SeekingAlpha,https://finnhub.io/api/news?id=d18b2e619c2cb62f0c149a038baa6c8bf14ba85be57904173bcfbb4c1f7eb3e4
GOOG,2025-12-02 12:55:48,"Nvidia: This Is No Bubble, The  Agentic AI Revolution Is Coming (Rating Upgrade)",SeekingAlpha,https://finnhub.io/api/news?id=0f91d87e0fddf61bef2a5de14626a572a741e8a404b8ae3dcaccad2f46fc60c4
GOOG,2025-12-02 12:37:37,Latest News In Cloud AI - SUSE AWS Partnership Strengthens AI and Cloud Capabilities,Yahoo,https://finnhub.io/api/news?id=9068be8391b7f51359197872e3ac9837745a2ba24b62296ad0e47dc3b4b222b0
GOOG,2025-12-01 21:05:26,Elon Musk Says These Mag 7 Stocks Not Named Tesla Are Set To Dominate,Yahoo,https://finnhub.io/api/news?id=fa3b65467c36a98fde0381a42796adf20c5b6b35fbce3bc61a9eeee8d93f9487
GOOG,2025-12-02 12:15:00,This Is the Biggest Threat to Nvidia's Artificial Intelligence (AI) Dominance That Virtually No One Is Talking About,Yahoo,https://finnhub.io/api/news?id=e33eb28258597a489339a53a8759414d7f00842743c833b4b4d025c894c65840
AMZN,2025-12-08 16:00:00,"Blue Current Inc. Closes More Than $80M Series D Extension Funding Round, Anchored by Amazon, to Deliver Industry-Leading Solid-State Batteries for Stationary Storage and Mobility Applications",Yahoo,https://finnhub.io/api/news?id=2eb4a03890e6c937a3846e77e15b629b0161142459db8fcd6f5af59256ac8b85
AMZN,2025-12-08 15:54:00,Marvell Stock Biggest Loser From Amazon’s New Chip. This Downgrade Proves It.,Yahoo,https://finnhub.io/api/news?id=2f81d37af2e4fd98543c3e82aab9264724b096d15dc14adb61d23741a92bf05f
AMZN,2025-12-08 15:45:56,Marvell Downgraded by Benchmark After Reported Loss of Key Amazon Chip Designs,Yahoo,https://finnhub.io/api/news?id=949a39167b6617afe29c6bcb557970bd1d3a2caac8280437c02e73fb68e7b536
AMZN,2025-12-08 15:40:15,Berkshire Hathaway stock picker Todd Combs departs to lead new strategic investment group at JPMorgan,Yahoo,https://finnhub.io/api/news?id=913834bd958be6c4e8474bc96584d54b3d668d6058728cfcad9f245d5bc74c8f
AMZN,2025-12-08 15:39:57,"SoftBank, Nvidia looking to invest in Skild AI at $14 billion valuation, sources say",Yahoo,https://finnhub.io/api/news?id=0f9f53554741226236a531a59f13c863c96641e3d65bf94442d4f2331028d651
AMZN,2025-12-08 15:39:00,Combs’ Departure from Berkshire Leaves a Gap in Managing Equity Portfolio,Yahoo,https://finnhub.io/api/news?id=a43818e0950be1ba1914c4b528db5a366571ef13290caa4ade61864b1235b6d4
AMZN,2025-12-08 15:37:59,These 2 South Korean stocks will ’win AI supercycle’: analyst,Yahoo,https://finnhub.io/api/news?id=7c187ddf0450191b23a06e08bac0a1a871313f4d8fd1fa41f027504e1c6640d2
AMZN,2025-12-08 14:45:49,"Netflix, Tesla downgraded: Wall Street's top analyst calls",Yahoo,https://finnhub.io/api/news?id=78570a4a754fd55bfba166a911422f5176e3442b462cd5a9ac9853e65a8d9cf7
AMZN,2025-12-08 14:23:09,Marvell Stock Down As Microsoft Mulls Switch To Broadcom For Custom Chips,Yahoo,https://finnhub.io/api/news?id=3c91966df1071695b93451e16d0645649808e625fa1b641d6398736b3a441a81
AMZN,2025-12-08 14:03:00,Nvidia Takes Top Spot in the List of Best-Managed Companies of 2025,Yahoo,https://finnhub.io/api/news?id=56998cf11ce94fe4850769063faafc13b1af982ee747d0190ed5807a6e871bfa
AMZN,2025-12-08 14:02:00,PARAMOUNT LAUNCHES All-CASH TENDER OFFER TO ACQUIRE WARNER BROS. DISCOVERY FOR $30 PER SHARE,Yahoo,https://finnhub.io/api/news?id=336dbfed99d4891525dd0bad335257abce2ec66b5fb235e0580b6f00bd313fff
AMZN,2025-12-08 13:36:43,Netflix-Warner deal would drive streaming market further down the road of ‘Big 3’ domination,Yahoo,https://finnhub.io/api/news?id=3e99148b0cca30e799591404c5e9dfb4af06e0a630a68c44dae539c35d38613a
AMZN,2025-12-08 13:29:00,The Trade Desk Declines 44% in 6 Months: How to Approach the Stock?,Yahoo,https://finnhub.io/api/news?id=d088ef082c722d18d9b247a164f67ae4548f1ee9bdd5aa0ff904637d0007ff46
AMZN,2025-12-08 13:04:57,Marvell stock falls on Microsoft-Broadcom talks and Amazon design loss fears,Yahoo,https://finnhub.io/api/news?id=111d54c511c5fa684c57373015ad060d1c7b6ba7539f0b37fc5596cdd553a490
AMZN,2025-12-08 13:00:00,"If You Invested $10K In PayPal Stock 10 Years Ago, How Much Would You Have Now?",Yahoo,https://finnhub.io/api/news?id=7e3d866060ad5a126e5289919d598dac44f06164a9bb9db9331c42faf3768b5f
AMZN,2025-12-08 12:08:39,Does Dividend Stability And Patent Wins Reframe InterDigital’s Licensing Story For Investors (IDCC)?,Yahoo,https://finnhub.io/api/news?id=5d51dc8cb9a3aaead2ef2ce402ffe61f3b74a18dc0c824030661c64981ab468b
AMZN,2025-12-08 12:00:33,Dollarama Price Target Raised to $218 at Desjardins,Yahoo,https://finnhub.io/api/news?id=d77019e5e6df345c9731a3589d56970489d1efdb5c1887f1e291410ffb4adbe2
AMZN,2025-12-08 12:00:00,X-energy Appoints Daniel Gross as Chief Financial Officer,Yahoo,https://finnhub.io/api/news?id=be98c158a88f51ce4ded9ffcfc28701dbb87a4446a0d1e1ea567d3a6e9c1b545
AMZN,2025-12-08 12:00:00,"Perion Integrates with Amazon DSP to Drive Scalable, High-Impact Advertising Creative Across Premium Inventory",Yahoo,https://finnhub.io/api/news?id=1b73d13c42c06301c3c7273b0f358a54908fc644f12a28e0c4589b8672a57a12
AMZN,2025-12-08 07:30:10,Why I'm Turning Aggressive Now - Even With Everyone Yelling 'Bubble',SeekingAlpha,https://finnhub.io/api/news?id=2aa56cb7406393d1c2affd80c6b3068491e55a71ca1032c90ab709702a7b542a
AMZN,2025-12-07 18:56:43,Tracking Stanley Druckenmiller's Duquesne Family Office Portfolio - Q3 2025 Update,SeekingAlpha,https://finnhub.io/api/news?id=66657b847919a5ce7bfbcf453aff95c0cb047bddd14e9f33f65918d299cab219
AMZN,2025-12-07 18:25:00,1 Quantum Computing Stock to Buy Hand Over Fist in December,Yahoo,https://finnhub.io/api/news?id=f8de05bda87e958d496dca8ca9aef770ed7cb501f1bc45d652c427b426a2af7a
AMZN,2025-12-07 18:00:50,"'Every Game Company' is Doing it? 'Arc Raiders' AI Scandal Explodes, Big Name CEO Suggests Hidden Truth",Yahoo,https://finnhub.io/api/news?id=cbb28d592d34ec39cb3c75078bd0bee46dec0b21530d6569fef8696fd189de1e
AMZN,2025-12-07 13:30:23,Why these 2 stocks have shockingly blown away Nvidia,Yahoo,https://finnhub.io/api/news?id=e1bccb65a94bff7a54687ac2deeab76e7787450b3f201eb02cbd7e1d9d8fb864
AMZN,2025-12-07 13:00:35,"If You Invested $10K In Adobe Stock 10 Years Ago, How Much Would You Have Now?",Yahoo,https://finnhub.io/api/news?id=3f48ad665d2bbc4c2f0b49d02eb2664a23d74358b5d20b4ece68a252d79d2ddc
AMZN,2025-12-07 10:20:00,Prediction: These 3 Stocks Could Be Worth More Than Apple 3 Years From Now,Yahoo,https://finnhub.io/api/news?id=269e948569d8119ecb826a7df652734123a46856121e52c0c56e40e988ac894e
AMZN,2025-12-07 07:30:07,The Trade Desk Is In War Mode,SeekingAlpha,https://finnhub.io/api/news?id=1fe48721147b0ee375b2cf564f10785de9be2f470fd714a3a52658f53f1f7856
