symbol,datetime,headline,source,url
AAPL,2025-12-08 16:44:04,"Apple to Enter AI Revolution in 2026, Wedbush Says",Yahoo,https://finnhub.io/api/news?id=68d1b9b2a1d844137c9758c37c189078364067c85e48da6e0a1625991734d66c
AAPL,2025-12-08 16:03:46,"Netflix, Apple, Five Below: Top analyst calls today",Yahoo,https://finnhub.io/api/news?id=dd73c392b6d26af7f54f3d287877eaa6e9a4fc42c345e154845271efa3d926f1
AAPL,2025-12-08 15:29:52,Nvidia Topples Apple As Best-Managed U.S. Company; Is Nvidia A Buy Now?,Yahoo,https://finnhub.io/api/news?id=5892ca92f121c685163475b2d5c5450a8da320e2acb5d52ca71317c7eb7303a0
AAPL,2025-12-08 15:28:30,Grid Tech Stocks Are Poised to Soar Even Further Amid AI Bubble Fears,Yahoo,https://finnhub.io/api/news?id=2cd12bff04bb066a835b2f009a201f989044d304b71f438a9f05c18ad7be9b67
AAPL,2025-12-08 15:08:46,Apple Gains Higher Wedbush Price Target on Strengthening AI Strategy and iPhone 17 Demand,Yahoo,https://finnhub.io/api/news?id=b9f4938cce27c9b68823cc9a17775034a1e782011cdcbb1e527e290524ad9846
AAPL,2025-12-08 14:40:33,Has the cash ISA shakeup encouraged you to start investing? Have your say,Yahoo,https://finnhub.io/api/news?id=b4169599d4896e47627993c5c67fc575a4afb7418267362941dd29ffef93b33f
AAPL,2025-12-08 14:03:00,Nvidia Takes Top Spot in the List of Best-Managed Companies of 2025,Yahoo,https://finnhub.io/api/news?id=56998cf11ce94fe4850769063faafc13b1af982ee747d0190ed5807a6e871bfa
AAPL,2025-12-08 14:00:02,Here is What to Know Beyond Why Apple Inc. (AAPL) is a Trending Stock,Yahoo,https://finnhub.io/api/news?id=41504c5b30058ca5ba2b6dd857e8fd513cf5dbe5c59a83df7500c078031a254a
AAPL,2025-12-08 13:00:20,"Oura vs Big Tech: The ring taking on Apple, Google & OpenAI",Yahoo,https://finnhub.io/api/news?id=450934db1a3e7c18140706327e1d8560c7eb1f27323c941762ae984fa14b58cb
AAPL,2025-12-08 12:54:36,Apple target raised: Evercore ISI says Intelligence to be a ‘sizable catalyst’,Yahoo,https://finnhub.io/api/news?id=4ab9e5c34a05ba570e2d95b5667c25c67b115f8b1648665d4cbce4fd2466a4ad
AAPL,2025-12-08 11:42:28,"Apple AI Strategy Finally Taking Shape Amid Key Hire, Expected Exclusive Partnership With Google Gemini, Wedbush Says",Yahoo,https://finnhub.io/api/news?id=25979e997d2c8e14114e2dff248da677bf60645b4f9cc98794bc91148088f886
AAPL,2025-12-08 10:38:09,Apple expands manufacturing training program with online courses,Yahoo,https://finnhub.io/api/news?id=42c61477338887f75082ecc5ece95bcaec7147df706b2fc58d44a54d2ab40321
AAPL,2025-12-08 10:35:05,Trump Tariffs: 3 Items That Surprisingly Haven’t Increased in Price Since April,Yahoo,https://finnhub.io/api/news?id=a9d747e9fa23d0c4d5fd85f77a15ce6774f86a24927344fa04a509035232e6d7
AAPL,2025-12-08 10:13:00,Peter Schiff once said he'd ‘be a lot richer’ if he invested all his money in the ‘Magnificent 7’ a decade ago.,Yahoo,https://finnhub.io/api/news?id=c3b6cd16e75c723e67d012ef5a87b4a35cb4f91aa59d7a3752b9377ce4155c71
AAPL,2025-12-08 09:39:34,Research Veteran Yardeni Ends 15-Year Tech Bet With Underweight Mag 7 Call,Yahoo,https://finnhub.io/api/news?id=3137bdf83ef49afa5cf6b42b386ab18b22f907b7656013b3672bd478e394c71d
AAPL,2025-12-08 08:00:00,Time To Buy This Future Dividend Aristocrat: Microsoft,SeekingAlpha,https://finnhub.io/api/news?id=15240514b4a45b894d674f072437e5555d04b16969dd55c0350af2de9d6f95d8
AAPL,2025-12-08 07:30:10,Why I'm Turning Aggressive Now - Even With Everyone Yelling 'Bubble',SeekingAlpha,https://finnhub.io/api/news?id=2aa56cb7406393d1c2affd80c6b3068491e55a71ca1032c90ab709702a7b542a
AAPL,2025-12-08 06:00:37,Why women are judged more harshly than men for using AI at work,Yahoo,https://finnhub.io/api/news?id=5d59a5fd3d2b3b51ab43ce92043ffcaa3220a18d01324f25e5106301fed86ede
AAPL,2025-12-08 06:00:00,Stock market history signals a reckoning for today’s AI spending surge,Yahoo,https://finnhub.io/api/news?id=15f66cfb70506eee8f6fdd54f1fabcaaecf0b91e95849dee0f194f395bfdce2a
AAPL,2025-12-08 05:32:01,Jim Cramer on Meta CEO: “Zuckerberg Makes Elon Musk Look Like a Real Softy”,Yahoo,https://finnhub.io/api/news?id=4b2f8e05dafd803d5e201159282d5417c8aeb9201ca9c912e9a4363d19b40582
AAPL,2025-12-08 05:01:00,Riyadh Air and IBM Partner to Launch World's First AI-Native Airline,Yahoo,https://finnhub.io/api/news?id=220d7d32123c7108ceaa57c05334b03a7383eb9bf640e6645359877dc86020a8
AAPL,2025-12-08 01:10:04,Is TSMC Slowing Down? Not For Long,SeekingAlpha,https://finnhub.io/api/news?id=db72a2a50cf60c527dbddfef1f004fb02165082801b2bfcf04aa2395906f0d2a
AAPL,2025-12-07 15:00:58,Apple's executive exodus sends a signal about its AI strategy,Yahoo,https://finnhub.io/api/news?id=8dbbb4b19919d2340d8edf2a29279c5ccffb49022f03893c78b600b499aba91a
AAPL,2025-12-07 13:30:23,Why these 2 stocks have shockingly blown away Nvidia,Yahoo,https://finnhub.io/api/news?id=e1bccb65a94bff7a54687ac2deeab76e7787450b3f201eb02cbd7e1d9d8fb864
AAPL,2025-12-07 10:20:00,Prediction: These 3 Stocks Could Be Worth More Than Apple 3 Years From Now,Yahoo,https://finnhub.io/api/news?id=269e948569d8119ecb826a7df652734123a46856121e52c0c56e40e988ac894e
AAPL,2025-12-07 09:24:17,FNDA Is A Good Alternative To Large-Cap ETFs Like VUG,SeekingAlpha,https://finnhub.io/api/news?id=7ea23c0102a7f04e37df62ffd311d71193bd1572ebe7f973cbe79d6646a79150
AAPL,2025-12-07 06:00:15,"'Our women's hiking trousers saved our business – we've sold over 50,000'",Yahoo,https://finnhub.io/api/news?id=25499f992a56b98d4faf12c03ba7d354eae157945ab28f364f923181c34069e3
AAPL,2025-12-07 05:50:00,Prediction: This Will Be the First Tech Company to Split Its Stock in 2026,Yahoo,https://finnhub.io/api/news?id=b67de530de3d9ee3496e65c062c576e960e85c65a16c85547b3d0dcad2f85399
AAPL,2025-12-07 05:00:00,"Pixalate’s Q3 2025 Report Uncovers 1,248 APAC-Registered Mobile Apps Across Apple App & Google Play Stores Violating COPPA, Impacting 117 Million Child-App Users in USA",Yahoo,https://finnhub.io/api/news?id=e5ea2a49e79c6be39b54719adf3a361f9bf0e701883734abe154eb7660a46a45
AAPL,2025-12-07 00:50:00,"1 Unstoppable Stock to Buy Before It Joins Nvidia, Apple, Microsoft, and Alphabet in the $3 Trillion Club",Yahoo,https://finnhub.io/api/news?id=ead391dc9ddd039e1a015ff8a6db85fdebb567054259e9e3cac40f7df1e19dd1
AAPL,2025-12-06 22:06:49,Does Jamf’s Sluggish Share Price Hide Long Term Value Potential in 2025?,Yahoo,https://finnhub.io/api/news?id=1088a4560c0d0d1962e00e8cd54922dcd6a2d6c414912334b4622d7c4b87659c
AAPL,2025-12-06 13:55:00,1 Magnificent S&P 500 Dividend Stock Down 14% to Buy and Hold Forever,Yahoo,https://finnhub.io/api/news?id=34e667768d4133c084db1c3683e4ddcc225382715e5e314b7c1f939472614741
AAPL,2025-12-06 12:53:00,1 Risky ETF You Want to Avoid Buying in December,Yahoo,https://finnhub.io/api/news?id=b26a8d2fe2372d247b7b262c878ed7fe4d66dd4e9c187009724cad411adeca8d
AAPL,2025-12-06 11:00:17,5 questions on what's next for Netflix after the Warner Bros. deal,Yahoo,https://finnhub.io/api/news?id=7df301ab39391af99a3c28747139cc3788d052782f013d43d8b51b8f68fbeab1
AAPL,2025-12-06 10:25:00,Here's Why Apple Is My Second Biggest Holding Going Into 2026,Yahoo,https://finnhub.io/api/news?id=aaa4ddf253d90db70fbf7f57a43602b6c87a4ad5d7c9cddc18e6725a1cdac71b
AAPL,2025-12-06 10:02:00,Why Apple's Momentum Isn't Accidental,SeekingAlpha,https://finnhub.io/api/news?id=9fbcaa1394751c99450e580145d6773e0d3a3c82afe1b8a6d758513755810af2
AAPL,2025-12-06 09:41:00,3 Reasons Costco Stock Is Struggling,Yahoo,https://finnhub.io/api/news?id=fa414c924621375a33c66d878f1d4a47f6eec1fab293b69ff8dcedf29f9651bf
AAPL,2025-12-06 09:21:19,Apple (AAPL) Earns $320 Target as Services Strength Offsets App Store Slowdown,Yahoo,https://finnhub.io/api/news?id=d393be4f0a334e94a1dc2ec294caf9b63cb7997b0fdea14c3d3cfde6233a2c8b
AAPL,2025-12-06 08:00:59,What the heck is going on at Apple?,Yahoo,https://finnhub.io/api/news?id=36ddfc5ecbfabec53fc2f3d055bbc916a595d10ef97099b43e01b63379daccde
AAPL,2025-12-06 06:00:14,'Weight loss injections are the buzzwords of the last few years',Yahoo,https://finnhub.io/api/news?id=2a7e90aad2be7a5b31c98f21a4a46382d2545bb7a959e0186bc2d8e923955f5b
AAPL,2025-12-06 00:49:36,Why Intel Stock Jumped Today,Yahoo,https://finnhub.io/api/news?id=e3f164f51279ea811e8c6509fa4115db1551f72e92ff0b7b90727fb56aec2242
AAPL,2025-12-06 00:07:00,"Apple Stock Can Rise on Services Segment, Says Analyst. Plus, Uber, American Eagle, and More.",Yahoo,https://finnhub.io/api/news?id=28da8378997c900f88ff6a1f8ea4f1ba42756da8e781e28a6544e2bc52b310a1
AAPL,2025-12-05 23:35:00,Why Tech's Comeback And A 'Hawkish' Fed Could Change Everything,SeekingAlpha,https://finnhub.io/api/news?id=0a7b162764491315bb361a9ebbfa1833f5d426a0167a7ba75228669972c838da
AAPL,2025-12-05 22:24:42,"Google Must Limit Default Contracts to One Year, Judge Rules",Yahoo,https://finnhub.io/api/news?id=0241605a4fae74aada5836d52cae35d28eb8b7518af1b1638c3e687ff05d21ad
AAPL,2025-12-05 22:03:08,Apple Inc. (AAPL): A Bull Case Theory,Yahoo,https://finnhub.io/api/news?id=1597e115cc2601c69f1d22999eee60e07718b6345def8dac12e5df5ae21b1658
AAPL,2025-12-05 22:01:45,Taiwan Semiconductor Manufacturing (TSM): A Bull Case Theory,Yahoo,https://finnhub.io/api/news?id=cbb0bdf899afa48a6b4eb697b9941852bfa50f9c2538045cb08835459dbbfc3a
AAPL,2025-12-05 22:01:05,Yelp Inc. (YELP): A Bull Case Theory,Yahoo,https://finnhub.io/api/news?id=cb492d314ca278747690bd6d6f5aeb34811ecd4cedccc39a4ced9b6eb933ba48
AAPL,2025-12-05 21:50:00,The Netflix and Warner Bros. Deal Is Far From a Sure Thing,Yahoo,https://finnhub.io/api/news?id=4f78a27465ac84897de77650d658a785c1b477c7c06b3d081c9d93f434ebbd77
AAPL,2025-12-05 21:21:33,"Peloton Interactive, Inc. (PTON): A Bull Case Theory",Yahoo,https://finnhub.io/api/news?id=a2ad67ed69d9c4241afe840ae4f26a039e732bff33b630a5e135fc9dff456d1b
AAPL,2025-12-05 20:27:16,Broadcom Stock Is Rising -- Mizuho Bets Big on AI Boom Ahead of Earnings,Yahoo,https://finnhub.io/api/news?id=356fe7afc12a5eeede9ba25fd2727a8db53cf2b599e58d7ede9aeac46e466b93
AAPL,2025-12-05 20:13:00,Cathie Wood’s latest move is alarming for big stocks,Yahoo,https://finnhub.io/api/news?id=c620dba0fa6443dc614fe157dc9e6c422bb2a12b5f56f7af78f8a871193a0765
AAPL,2025-12-05 19:02:40,Meta acquires AI-wearables startup Limitless,Yahoo,https://finnhub.io/api/news?id=22560190551838c239aaa980599a1369208046f3c4a169ebc48815d50813986a
AAPL,2025-12-05 17:46:25,Judge finalizes remedies in Google antitrust case,CNBC,https://finnhub.io/api/news?id=7a5753327f748845ac21c34fca926498a81a5ccfbc545b42c9dbe30a0d74054d
AAPL,2025-12-05 17:27:53,eSIM adoption is on the rise thanks to travel and device compatibility,Yahoo,https://finnhub.io/api/news?id=b009a6909eb38870c53a7fbdbe52df1caceb678ff080937b5e83bd053d7351f4
AAPL,2025-12-05 17:05:00,"Meet the Supercharged Growth Stock That Could Join Apple, Nvidia, Microsoft, and Alphabet in the $2 Trillion Club by 2028",Yahoo,https://finnhub.io/api/news?id=45d3f7911ad40029927f5d5c78035272379c45f72ff600fa267a3e832482811f
AAPL,2025-12-05 16:54:24,Intel (INTC) Falls 7% from Record High as Traders Book Profits,Yahoo,https://finnhub.io/api/news?id=a9cf92fbcc185e63e31901959a49f17a28c65df84503a0ea60df3937e0883f4a
AAPL,2025-12-05 15:48:57,"Apple Made a Comeback with the iPhone 17, But Will Executive Exits Pull Down AAPL Stock?",Yahoo,https://finnhub.io/api/news?id=373630e1a93f8f4a700479af677491881e1ba1159d36675f9c4fce951f90361d
AAPL,2025-12-05 15:38:27,"Netflix to acquire Warner Bros., more executive departures at Apple",Yahoo,https://finnhub.io/api/news?id=bc73e60027b9e7f7efc300dae1194ddcc38717534d744fc381e64dbe6bb575c8
AAPL,2025-12-05 15:37:10,Still love Netflix long-term despite near-term pressure from WBD deal: G Squared's Victoria Greene,CNBC,https://finnhub.io/api/news?id=2eead0acc348b856d09c64636d5ec6af1ff93771cc0d06caa4e1f6a85410cb34
AAPL,2025-12-05 15:29:54,Apple Reaches All-Time High This Week -- Proves It's Still in AI Race,Yahoo,https://finnhub.io/api/news?id=4555725b4c2dda62f311f99806eaaf414bcf16d2957fa9866fffdb57d76aadee
AAPL,2025-12-05 15:15:49,Apple Warns Users in 84 Countries of New Cyber Threat Activity,Yahoo,https://finnhub.io/api/news?id=16022de9e79ffe176feb38add27c45f091e3d304998d6c83d6be92a51d09675e
AAPL,2025-12-05 14:58:22,What Apple's executive departures mean for the iPhone maker,Yahoo,https://finnhub.io/api/news?id=b550fa1fda19d125a0675b2a539c8c5107554e61288f2bb601f3f2ae4605b265
AAPL,2025-12-05 14:42:06,India weighs greater phone-location surveillance; tech giants protest,Yahoo,https://finnhub.io/api/news?id=97cc43e61a7810938918faa405f9e831c03fb878a1a24fad7abbe61bfe0579b9
AAPL,2025-12-05 14:21:24,ChatGPT Thinks Apple Stock Price Will Close At This Level By The End of 2025,Yahoo,https://finnhub.io/api/news?id=944d0e16ee609ba16115e06a60a8c1e0a67e8541121dfacd4f39027052172ee7
AAPL,2025-12-05 14:19:45,"Netflix reaches $72B Warner Bros. deal, PCE inflation data",Yahoo,https://finnhub.io/api/news?id=149ae2385c011c04bb85431cfbd4879f8d54686a62776b9cb3f42cbb4d1a241e
AAPL,2025-12-05 14:16:14,Did Rachel Reeves mislead the public before the budget? How readers voted,Yahoo,https://finnhub.io/api/news?id=7f26bfe1edb49f1b5c78e62ee7934a946054d82ab6a45593557feb917365da25
AAPL,2025-12-05 14:15:00,Wall Street Roundup: Netflix Buying Warner Brothers,SeekingAlpha,https://finnhub.io/api/news?id=b4006d9f56f43cb540d6d9f1a25522b815dd0f05690f8db3c12df21dbe4214e8
AAPL,2025-12-05 12:56:47,"After Neuralink, Max Hodak is building something even wilder",Yahoo,https://finnhub.io/api/news?id=e7b7545fcdaf7bd286510f5997ba3290148c094b9541e171e5b79e33ffb372b3
AAPL,2025-12-05 12:42:00,Meta Opens a New Frontier in AI Race. Why It’s a Warning for Apple.,Yahoo,https://finnhub.io/api/news?id=26370646a2a586fac670e51aefc0035cdb6a7c61d7ab90bd991c8c235ad2651f
AAPL,2025-12-05 12:37:49,This Week In Cloud AI - Centrilogic Achieves Elite Microsoft AI Cloud Partner Status,Yahoo,https://finnhub.io/api/news?id=49ef7358cf0a0dce3832f60e5d4d637ca7dbbf25f044169b5d2cdea3d1aa6474
AAPL,2025-12-05 12:22:15,Buy shares of this AI winner into earnings next week: Mizuho,Yahoo,https://finnhub.io/api/news?id=3c190e2bdc012535f587179808b8abd10e18609d7cea305b59dcfbe0e77dbac4
AAPL,2025-12-05 12:00:14,How A Top Mutual Fund Manager Can 'Cast A Wider Net',Yahoo,https://finnhub.io/api/news?id=fa48271f40f42f709b3a6955cf223005c01bceb94ad4c12a45a51d80ae030bfd
AAPL,2025-12-05 12:00:02,3 Bull Put Spread Ideas to for December 2025,Yahoo,https://finnhub.io/api/news?id=b34dc48ee7e2d77bb0b67213d47c1d4e073000af4ce152bec4aa523eaf11cbe7
AAPL,2025-12-05 11:03:00,"Nvidia Stock Rises. What Foxconn, HPE Sales Say About AI Chip Demand.",Yahoo,https://finnhub.io/api/news?id=51d121ec569995b351861dc03ef41e770edb6430386021d127a767b42228115b
AAPL,2025-12-05 10:35:00,"Ranking the Best ""Magnificent Seven"" Stocks to Buy for 2026. Here's My No. 2 Pick.",Yahoo,https://finnhub.io/api/news?id=88c64000ecc0bee51719a27ec133e1d528e7e2c676c428f8742be1db1ebf0f35
AAPL,2025-12-05 09:47:35,The Club's top 10 things to watch in the stock market Friday,CNBC,https://finnhub.io/api/news?id=7e4621dad23aac370a133115c6d928f4e53e269b0d0ceda92e6924952cd052fd
AAPL,2025-12-05 09:31:00,"Down 91% From Its All-Time High, Can Snap Stock Snap Back in 2026?",Yahoo,https://finnhub.io/api/news?id=3831ef95256143574ecbd4f4166c2fcd852a656e8881510f7aed928053f5e44a
AAPL,2025-12-05 09:00:29,Meta's Next Idea Could Be Bigger Than The Smartphone,SeekingAlpha,https://finnhub.io/api/news?id=a7080240613818632bb3831a4f11da0d1fe0f7db2a964bc1186c5558db07d7e2
AAPL,2025-12-05 08:00:00,Apple May Actually Be Winning the AI Race,Yahoo,https://finnhub.io/api/news?id=317948d4bd08e831267e36947aef4c703a8782a765c181e485df5bd4ed0500c7
AAPL,2025-12-05 06:00:48,"UK’s new tax rules could trigger crypto boom, says Aave CEO",Yahoo,https://finnhub.io/api/news?id=9041fb9ab772de2355cfac4ae68d32c1377088a388db715a509f571168db6e44
AAPL,2025-12-05 06:00:14,10 fabulous homes convenient for Christmas markets,Yahoo,https://finnhub.io/api/news?id=c022c85cced1c6fbc6ea1c5782c5640d918d155d84f80c2210f6edb9d799be81
AAPL,2025-12-05 05:55:00,Apple Departures Point to Challenges for iPhone’s Dominance,Yahoo,https://finnhub.io/api/news?id=f386d326b319c1e18f02922596b284c33ca1e34e17ac3ea6e0ed31510f5206f3
AAPL,2025-12-05 05:41:22,Nvidia partner Foxconn reports 26% revenue spike as AI boom continues,CNBC,https://finnhub.io/api/news?id=b724c79b70f331eb4245cfa61c8c924dc43d6f613541856c08bcdee91633e894
AAPL,2025-12-05 02:50:47,"Globalstar, Inc. (GSAT): A Bull Case Theory",Yahoo,https://finnhub.io/api/news?id=e8b988c4326ebb9125c1af60c988c57060dbae926cf08780046a53f095717ec1
AAPL,2025-12-05 02:47:57,Arm Holdings plc (ARM): A Bull Case Theory,Yahoo,https://finnhub.io/api/news?id=3a418682aa8104f7fbd274b877cf07dec21fe2144ed4146b782d18c74716469f
AAPL,2025-12-05 02:35:00,Why Warren Buffett Is Quietly Increasing His Stake in Alphabet,Yahoo,https://finnhub.io/api/news?id=2b9a6206f9a10382e2682a1f52f0fb2a297a6e580a152c74e0daabec92214234
AAPL,2025-12-05 02:30:02,CNBC Daily Open: It's a rich Nvidia's world,CNBC,https://finnhub.io/api/news?id=6a8badae2171317e2ad2dd033e5880115d2dceadec979067be9766fe53cec2e0
AAPL,2025-12-05 02:28:52,"Amkor Technology, Inc. (AMKR): A Bull Case Theory",Yahoo,https://finnhub.io/api/news?id=183c6f0fe4f91b71bf8a1015adec2f82aaa21932d2fc38ee1d48fdad322a3c90
AAPL,2025-12-05 00:52:00,Meta Plans to Shift Spending Away From the Metaverse,Yahoo,https://finnhub.io/api/news?id=d1592ce3a000645b98a1505173cc84fc9129b02c30cffa57ff9bb9c33ece82ba
AAPL,2025-12-05 00:17:00,"Top Apple Executives to Leave, Adding to Recent Departures",Yahoo,https://finnhub.io/api/news?id=81ee4c610f0d5f6320dc8e429f3ff88b04c58d2827e2902f8671dbfbcccc4fc0
AAPL,2025-12-04 22:28:01,Apple’s executive shake-up continues with departures of general counsel and policy head,Yahoo,https://finnhub.io/api/news?id=f65c2d21a5b53a087cb44dec6eb6ec4cf6eb1883eb1675731ceb858caf09c5a2
AAPL,2025-12-04 21:30:00,Apple announces executive transitions,Yahoo,https://finnhub.io/api/news?id=7fd5793c214d47dde1220f3175a2d931387d8d6f2f05f061312c74f275ebf5be
AAPL,2025-12-04 20:43:01,"BTIG thinks Apple stock is poised to drop, PepsiCo nears settlement",Yahoo,https://finnhub.io/api/news?id=747015635cc48c02fa8e7d57b9d941b0586b634b03289fd867769c6d9585323c
AAPL,2025-12-04 20:14:04,"CNBC Daily Open: Money, money, money, in Nvidia's world",CNBC,https://finnhub.io/api/news?id=9a96f9a277f25f701b3d00873d8be3fa289a45960af100951b642ca9386d1018
AAPL,2025-12-04 19:15:24,Chubb Limited (CB): A Bull Case Theory,Yahoo,https://finnhub.io/api/news?id=5bd83a2d4d935bc29dacd3a16223e5a7a6acd5f224e7e711100303ddfc090bae
AAPL,2025-12-04 19:05:00,Life After Mag 7,SeekingAlpha,https://finnhub.io/api/news?id=c38555e88047facc8834f9ca10dc0e07d30b72fdbb66736877b7a61e91900d83
AAPL,2025-12-04 18:39:00,Prediction: This Will Be the World's Largest Company By Year-End 2026 (Hint: It's Not Nvidia),Yahoo,https://finnhub.io/api/news?id=b024f31c24db84049143199d91d5fb9f2327668ee77642034bd9682ae9ae3f42
AAPL,2025-12-04 18:07:26,My Outlook For The Market In 2026: An Optimistic But Cautious Stance,SeekingAlpha,https://finnhub.io/api/news?id=6689686e7f93a7b5696a215ef772a2b33604ab92c19f4c84fdddbc412139422f
AAPL,2025-12-04 17:04:17,QUALCOMM Incorporated (QCOM): A Bull Case Theory,Yahoo,https://finnhub.io/api/news?id=8f96fbe973ef8ea8e4f4f6b1c0381eaeaea73420d9774e9a62ee74655a8fe561
AAPL,2025-12-04 17:03:56,Jamf Holding Corp. (JAMF): A Bull Case Theory,Yahoo,https://finnhub.io/api/news?id=d7a56db9661483735a62e26cf5c89588d5f81f68b79e435e4151aa0119b95ce7
AAPL,2025-12-04 16:45:20,"GXO Logistics, Inc. (GXO): A Bull Case Theory",Yahoo,https://finnhub.io/api/news?id=15fecd9ff31c7ae96152edfe9fe85e99e899fb805577d006388d440968114250
AAPL,2025-12-04 16:24:25,Apple: Inventory Does Not Lie,SeekingAlpha,https://finnhub.io/api/news?id=6d310d830e15848f2dafc6173db976500077964c697481868485671015958f36
AAPL,2025-12-04 15:31:05,British Land promoted to FTSE 100 as WPP falls out after nearly three decades,Yahoo,https://finnhub.io/api/news?id=2a3e1b43429850535f7af255155d8db70c1a26c792bacf537ebcc9de56e2ea35
AAPL,2025-12-04 15:00:54,Meta stock climbs on report company will make major cuts to metaverse efforts,Yahoo,https://finnhub.io/api/news?id=63cf39433672160c4692f6ab76d913c51dc3ce12d7677cb8a08c9f154749b845
AAPL,2025-12-04 14:38:55,Intel Stock Surged 10% on Apple Chip Manufacturing Hopes—Time to Buy?,Yahoo,https://finnhub.io/api/news?id=4b5c4bb70bce563b68459f1851988fb1cc5e755502b9312b6a17773c918ec187
AAPL,2025-12-04 14:22:52,Stock Market Today: Dow Rises On Surprise Jobless Claims; Snowflake Plunges On Earnings (Live Coverage),Yahoo,https://finnhub.io/api/news?id=a53d908fa6bc606ba6078b92a7c297453e7beb8d47052c6e04a79c5003c8f1e2
AAPL,2025-12-04 14:03:00,MCO (MyComplianceOffice) Partners with FirmScribe to Deliver iMessage Retention Capabilities,Yahoo,https://finnhub.io/api/news?id=a32c760a437707352b78b5adfd83428fa79e11b90b2dc7389eca42bc62047cf6
AAPL,2025-12-04 14:00:00,Apple unveils the winners of the 2025 App Store Awards,Yahoo,https://finnhub.io/api/news?id=22f6c9a8721f13d2cd624895e467e2c3da5c80c35f4082dba572ac62f5867e4b
AAPL,2025-12-04 14:00:00,Greenlight’s Annual Family Trends Report Uncovers Bright Spot in Consumer Finance: Kids are Building Wealth Through Investing,Yahoo,https://finnhub.io/api/news?id=c3db370f77b9f6ef968eb9d8ecaeba895fbd5cd68af793be9b3b7727c8d887f1
AAPL,2025-12-04 13:49:44,Salesforce Stock Rises -- Smashes EPS Forecast and Unveils Bold 2026 Outlook,Yahoo,https://finnhub.io/api/news?id=ffb7ebeed594edebbcc5a494c07553197534d8406323e6a571b3e5bef22f6799
AAPL,2025-12-04 13:48:44,Crypto Reels From a $200 Billion Crash as Casino Crowd Moves On,Yahoo,https://finnhub.io/api/news?id=5650513d71640d60db8a97684c3275f4cad8919f692ee5d7846e442e9832a816
AAPL,2025-12-04 13:32:59,Here’s Why Apple (AAPL) is on the Detectors List of Brown Advisory Large-Cap Growth Strategy,Yahoo,https://finnhub.io/api/news?id=f6facbe117c3c151cef24dcf1a162b3237fca25167734bbb2820ad8112dee51d
AAPL,2025-12-04 13:30:00,5G+ just got a whole lot faster: Bell delivers its top mobile speeds across parts of Ontario,Yahoo,https://finnhub.io/api/news?id=d4732d72c65417e4ff5700b6447de86571888d7d02294cf2b7ce7bd1195d3703
AAPL,2025-12-04 11:37:10,Apple Loses Longtime Design Leader Alan Dye to Meta,Yahoo,https://finnhub.io/api/news?id=2c40b66a27c440f6f4fe5507d1de94856e225bdd94ad787659bf71d6e9634391
AAPL,2025-12-04 10:48:18,Alphabet’s AI Chips Are a Potential $900 Billion ‘Secret Sauce’,Yahoo,https://finnhub.io/api/news?id=74d565f7d0222e39927b442b13d57634fba646e502d19b99abc62269cee6d0d3
AAPL,2025-12-04 10:05:00,Is Alphabet Really a Threat to Nvidia's AI Chip Dominance?,Yahoo,https://finnhub.io/api/news?id=0280aafa2d801d36ca028958d29d420d86730b47bdd5244105858f9d04f35d60
AAPL,2025-12-04 10:00:00,Democrats Press Firms About Trump Ballroom Donations,Yahoo,https://finnhub.io/api/news?id=7602fbd4b4c5186f964eabdf451937474ab20a4f5046f7767d2966ceb2ecc695
AAPL,2025-12-04 09:59:32,Bitcoin price edges higher as traders bet on Fed interest rate cut,Yahoo,https://finnhub.io/api/news?id=59e2e896929ad3f2c461d63eb679de3c04f69f95f4305a429c2c98a786e9b9ba
AAPL,2025-12-04 09:32:07,"Trending tickers: Salesforce, Microsoft, Netflix, Capricor Therapeutics and Vodafone",Yahoo,https://finnhub.io/api/news?id=55ee8b321210f802ca3d9bf2482eb830a3b7459bc729f37fd0473efa717eabff
AAPL,2025-12-04 09:30:52,Alphabet: Something Doesn't Add Up,SeekingAlpha,https://finnhub.io/api/news?id=d5cd73513b6f2df053242fb90abea6f3cb9a95d79580cbc62e781e0d9d6800c6
AAPL,2025-12-04 09:15:51,Apple (AAPL) Price Target Raised as Loop Capital Sees Stronger iPhone 17 Demand,Yahoo,https://finnhub.io/api/news?id=3cb96b34be249b4c3c6f73e4e0bf82c07a34c106d736de7fc690ad583f4fd96b
AAPL,2025-12-04 09:09:22,Could Intel’s Apple Chip Ambitions and Malaysia Bet Redefine Its Foundry Narrative (INTC)?,Yahoo,https://finnhub.io/api/news?id=af15d1b8de4f4a6920c54ae4086517f2d3bbd4c1e72fa2d823059a4f8527cbe6
AAPL,2025-12-04 08:00:02,"Bids for WBD are in. Here's what Paramount, Comcast and Netflix could do with the assets",CNBC,https://finnhub.io/api/news?id=33a25237b831321996cef0214ff92928fb4ff65ccec91c9d968ed84ae82efc4e
AAPL,2025-12-04 07:00:01,GM's new product chief Sterling Anderson eyes technology renaissance for automaker,CNBC,https://finnhub.io/api/news?id=7d119c8e2ebcd332397938e67ff76d99bfae0461d63eb9a119c60ec86926a1ae
AAPL,2025-12-04 06:00:10,Most popular stocks and funds investors bought in November,Yahoo,https://finnhub.io/api/news?id=c571bdb72fd5d9579f1b780e61b6067622da269984642033b863489379806a7b
AAPL,2025-12-04 06:00:00,How to navigate an end-of-year performance review with minimal stress,Yahoo,https://finnhub.io/api/news?id=b846331afd0f88b8654879d35ca5295632c61e88bf9a062ac41b9df40ccaf2ff
AAPL,2025-12-04 05:25:46,CNBC's Inside India newsletter: How a government app in India triggered a backlash over internet freedom,CNBC,https://finnhub.io/api/news?id=9c6c79065989995b4f1fbe1a8833d7aff5c2298e66cf4e3401286776192fef1e
AAPL,2025-12-04 05:20:03,Meta faces Europe antitrust investigation over WhatsApp AI policy,CNBC,https://finnhub.io/api/news?id=7af7b7c4cb671d2114c25133d6009bf07597b7b5b005f5421d02e89e2926c845
AAPL,2025-12-04 00:40:57,Forget Intel Stock: You Should Buy This Unstoppable Tech Leader Instead,Yahoo,https://finnhub.io/api/news?id=bd3c7caf33557b7598e479ea1df3e6792e0f95eed6e967dd417a08012ce3f127
AAPL,2025-12-03 22:35:51,"Apple, Nvidia, Verizon, IBM, & more: 2025's stock pick standouts",Yahoo,https://finnhub.io/api/news?id=4dc88741c2fc1376a423f05f3faa818196bf9f54ad485dbcda6fd4bf6a6e7e3a
AAPL,2025-12-03 21:58:44,"Walmart Stock Rallies, Pushing Market Cap Above $900 Billion",Yahoo,https://finnhub.io/api/news?id=eb40673094d3dd4562cdfe52f4f41a2bc39b34be91f39af1fa416f82d4ac32d0
AAPL,2025-12-03 21:26:10,Apple's stock is hitting new highs: How to play it with options,Yahoo,https://finnhub.io/api/news?id=02963423c34877bf8a95bb876f401a819d8783c088ea3548ee042db3282a495d
