symbol,datetime,headline,source,url
PEP,2025-12-03 13:31:32,PepsiCo cuts jobs in Ireland,Yahoo,https://finnhub.io/api/news?id=68f3609e74f63118aa435069859716412308c19a76166920947def2b8e04f957
PEP,2025-12-03 12:00:00,Celsius Holdings Highlights 2025 Execution Progress Ahead of Morgan Stanley Global Consumer & Retail Conference,Yahoo,https://finnhub.io/api/news?id=f0d3d4e30ff00ed19ed9042e5a72ac30d2e2d8cdf3d482e72df62a260ff37a57
PEP,2025-12-03 09:20:15,GoTo Foods hires Omer Gajial as new CEO,Yahoo,https://finnhub.io/api/news?id=6e31ff5d660812bbcc8065f0921693d15816fbd884810d663e7888987442811d
PEP,2025-12-03 05:26:41,Celsius Expects A Noisy Q4 But Will Still Grow Rapidly In 2026,SeekingAlpha,https://finnhub.io/api/news?id=78c6f8315736737cf1df3bcc547cb7571b36915d27cdef85ea4ce3d2b93c297b
PEP,2025-12-02 20:38:54,"Kraft Heinz, Mondelez, PepsiCo, Coca-Cola, General Mills Among Food Makers Sued by San Francisco Over Ultra-Processed Products",Yahoo,https://finnhub.io/api/news?id=07336d055d6ebf1d89f31b6fe678ed701b36d1ad46288a95cf4352896e6731fa
PEP,2025-12-02 14:00:00,GoTo Foods® Appoints Omer Gajial as Chief Executive Officer,Yahoo,https://finnhub.io/api/news?id=79c0882c236a19e7b0209c82c05c69901ab4a85452d698740563d3347ccc8992
PEP,2025-12-02 09:00:00,PEPSICO® ANNOUNCES LANDMARK GLOBAL PARTNERSHIP WITH MERCEDES-AMG PETRONAS F1 TEAM FOR 2026,Yahoo,https://finnhub.io/api/news?id=a185ec3403af1f151e19381ceaeb91823e388bb0ef4564c32c2e9dc5e1219b6b
PEP,2025-12-01 17:26:00,Can PepsiCo Achieve Its Mid-Teens PBNA Margin Ambition by 2026?,Yahoo,https://finnhub.io/api/news?id=6e92989414b5240e8a5adaba351e78caad3cf06f4c62234955b1eb3cbe177330
PEP,2025-12-01 14:15:00,Celsius Holdings Posts 51.3% Gross Margin in Q3: Is It Sustainable?,Yahoo,https://finnhub.io/api/news?id=a01e7e2951d796fa8e7ffcb66bb204a3909caa66d2f9011895e525cf9a6d4f25
PEP,2025-12-01 14:07:00,"If I Could Only Buy and Hold a Single Stock Today, This Would Be It",Yahoo,https://finnhub.io/api/news?id=09a781e8ec797d7ede7e8e8658b980e857e3f7b9ec143b68ae09dc520d4f7f8c
PEP,2025-12-01 09:07:00,"NBA Finals 2025 Post Event Analysis Report Featuring 2K Sports, Nike, PepsiCo, Emirates Airline, Michelob Ultra, State Farm, Tissot, AT&T, American Express, Google",Yahoo,https://finnhub.io/api/news?id=7cd701ea167e05e2b33c786447c8ac316062512e6293ed5b93bc437bee2433aa
PEP,2025-12-01 07:30:00,My 2-Way Escape Plan Before AI Disrupts Everything,SeekingAlpha,https://finnhub.io/api/news?id=771c1aa32b96358c13b97c1af8e9e3e77cb7ae9eaae5335879ed8368aebbd886
MCD,2025-12-08 15:01:00,"Lumana Surpasses 50,000 Cameras, Cementing Its Leadership in AI Video Surveillance",Yahoo,https://finnhub.io/api/news?id=df777cffb94bb49eed7962115835eb9ef653d408fa3d05dba646cb88fa14fa5e
MCD,2025-12-08 15:00:08,"McDonald’s Is Watching Prices Closely, It Tells Franchisees",Yahoo,https://finnhub.io/api/news?id=35597c12353edfba3ac365ce0c629db9a3d59457e55982f291cd8a91e2b8e8b6
MCD,2025-12-08 10:00:00,Allison Worldwide Expands Global Leadership with New Europe CEO,Yahoo,https://finnhub.io/api/news?id=0a19db90ed8722b3d4460015310238a2622e9c1dc1654e05ca24f4e8270a6ec7
MCD,2025-12-08 04:40:25,1 Unpopular Stock That Deserves Some Love and 2 We Avoid,Yahoo,https://finnhub.io/api/news?id=a2ab1318248ca41a865193f3908c6bb74a5658764a318f33e0a2dcabec3b96a2
MCD,2025-12-08 02:37:00,"Forget menu prices, McDonald's quietly makes massive financial move",Yahoo,https://finnhub.io/api/news?id=d35b45429b8ee36284b7187e9e2e0c793320009ebe258484c223999d8d26c11e
MCD,2025-12-07 19:30:00,This Once-Popular Fast Food Chain Made One Pivotal Mistake,Yahoo,https://finnhub.io/api/news?id=4abfd3a1117b31709c964580cf3b83c96d02c97e4b2b7606d33de508debad034
MCD,2025-12-07 17:47:00,Coca-Cola quietly makes a massive change to its soda brands,Yahoo,https://finnhub.io/api/news?id=dd15bd08a93f628b9b2a13d4b6cce33387a58c3ea9735de046276a88288db801
MCD,2025-12-07 14:30:02,McDonald's Stock Looks Cheap - Analysts Are Lovin' MCD and Raising Their PTs,Yahoo,https://finnhub.io/api/news?id=49fc8492063b75c1248382f75edb02de3b4589aa022544e58aed0a79aee33c89
MCD,2025-12-07 09:15:09,Will Grinch Meal Buzz and Collectibles Strategy Meaningfully Shift McDonald's (MCD) Brand Relevance Narrative?,Yahoo,https://finnhub.io/api/news?id=0b10dcc8296a70a3dab1f1f3e3259edc549f49571ab778b48390e62d6896cebf
MCD,2025-12-07 07:08:32,How New Analyst Views Are Rewriting the Story Behind McDonald's Stock,Yahoo,https://finnhub.io/api/news?id=fff3a2a4f505140498d2bd9e9c2ffc1686adc5e7844cbf214213fd6e9ee5aee5
MCD,2025-12-06 18:50:00,How Good Has MCD Stock Actually Been?,Yahoo,https://finnhub.io/api/news?id=2016c98449e4239a0965ca295d4c0ec269066bd037c659971dd3d58da24e3204
MCD,2025-12-06 18:17:00,"McDonald's, Burger King, Wendy's rival closing more restaurants",Yahoo,https://finnhub.io/api/news?id=b94767bca275c8e46f434f431e522f42bdedf3e817afdd7a989f35fe8d13650e
MCD,2025-12-06 17:00:00,This Best-Selling McDonald's Menu Item Outsells Every Burger And Nugget,Yahoo,https://finnhub.io/api/news?id=0a88afa4f4292f78552343f3473321e8eda18a166d64d92490e901df4cdae813
MCD,2025-12-06 00:30:45,"Dividend Champion, Contender, And Challenger Highlights: Week Of December 7",SeekingAlpha,https://finnhub.io/api/news?id=81d9840c52184ff00b18ae88dd7f70e73825caa975f17fd02baf431b26bd99c1
MCD,2025-12-05 16:30:05,McDonald's (MCD) Up 3.4% Since Last Earnings Report: Can It Continue?,Yahoo,https://finnhub.io/api/news?id=29b2e4d16d5267f42b11cef7b9c501b55238e38b48132e3a5713e2ec3ad68d9e
MCD,2025-12-05 13:36:00,Will McDonald's Beverage Strategy Reignite Its 2026 U.S. Momentum?,Yahoo,https://finnhub.io/api/news?id=827c750fbab6e032b2e11c723cd0078958fbf6f253756e56b679ec6553edd3b6
MCD,2025-12-05 11:30:00,The World's Largest Fast Food Chain Isn't McDonald's Or Starbucks,Yahoo,https://finnhub.io/api/news?id=94cfb6c1873fb3e39265019133624d20b51b44e3f2900b986bea842f4eccc565
MCD,2025-12-04 18:12:21,Is It Too Late to Consider McDonald's After Recent Digital and Expansion Initiatives?,Yahoo,https://finnhub.io/api/news?id=4ec116231db12a74fe6bc32c096f00c1305f2171214159e686b4eaa7b74bb42b
MCD,2025-12-04 16:22:56,"If You Think a Selloff Is Near, Grab Some Insurance with These 3 Stocks",Yahoo,https://finnhub.io/api/news?id=3eb2496e0bab1f9185405ea244bcca3312e8d6017c793762f3ae2487856b6477
MCD,2025-12-04 15:17:00,Chipotle Recalibrates Pricing Playbook as Inflation Pressures Build Up,Yahoo,https://finnhub.io/api/news?id=f0f12085652167bb6ff02b03228dbf120aa9ac4db9e7c6efdccddaea7f32ea54
MCD,2025-12-04 13:24:22,Wendy's: Too Cheap To Ignore While It Tries To Revitalize The Brand,SeekingAlpha,https://finnhub.io/api/news?id=df5961edc4e0a501d2f2119a888041b6c3dfed836940ec1d1476878133aa3751
MCD,2025-12-04 13:01:01,These 3 charts show how the biggest private equity funds keep winning in a fundraising slowdown,Yahoo,https://finnhub.io/api/news?id=1763292176d4b570fe2c8643f76e355408fdf09ec33ce2666e58a196a1c393fc
MCD,2025-12-04 11:30:00,The Most Profitable Fast Food Restaurant Chain In The World Is Also A Favorite,Yahoo,https://finnhub.io/api/news?id=02a0db88c977c9a3cadd5882d502566c533df1a9f0d0b635442932106841732e
MCD,2025-12-04 05:04:56,"Jim Cramer Says “Buy, Buy, Buy the Stock of McDonald’s”",Yahoo,https://finnhub.io/api/news?id=e846d298893317808c3d781587c48e5417a878a1535f4a7c70540ee5d3966f4d
MCD,2025-12-04 02:01:14,"'Just Beginning,' Awardco Founder On The Superpower That Allowed Him To Build A $1 Billion Business",Yahoo,https://finnhub.io/api/news?id=20b91770c04d46b2740404d63b9756c64d9559f8b2e1bee352d8da428a6fa4cd
MCD,2025-12-03 13:40:00,"UnitedHealth, Nike share gains lead Dow's nearly 400-point climb",MarketWatch,https://finnhub.io/api/news?id=211dfdb5dfd6fa0b009c58590ffeeab9e504577a015a216b04dfa725f766585c
MCD,2025-12-03 12:02:23,"Buy Verizon, December's Ideal ""Safer"" Dog Of The Dow",SeekingAlpha,https://finnhub.io/api/news?id=2667faafae3ff28b914df962f1f36c6af7bda25b202492689598e8cf884cc067
MCD,2025-12-03 10:45:25,"Dow extends gains, Nasdaq and S&P 500 flip higher in late-morning trading",MarketWatch,https://finnhub.io/api/news?id=15951efe285bd87f0e05d27e1cee95d0fa153c09d22aa2d3d4c2081703d3f5f6
MCD,2025-12-03 10:25:00,"Dow up nearly 150 points on gains for shares of UnitedHealth, McDonald's",MarketWatch,https://finnhub.io/api/news?id=ea5019515b07d28ae95e234fbaa3fcf29b9e9fa938ebab819abff3cabd5372a4
MCD,2025-12-03 10:00:00,"A Chinese ice cream chain, powered by super-cheap cones, now has more outlets than McDonald’s",Yahoo,https://finnhub.io/api/news?id=7d4511037a13526fd504f8ba688b887f55d0213ec09aa719c441c8537e504de6
MCD,2025-12-02 17:33:00,"Family favorite restaurant chain closed over 1,000 locations",Yahoo,https://finnhub.io/api/news?id=769f9f07e238cbec6c041d0ebe15211aae882de89eb0d353d4493b534490f8d3
MCD,2025-12-02 16:54:09,Burger King doubles down on burgers amid chicken craze,Yahoo,https://finnhub.io/api/news?id=dc52ccf37b109d586f7d2707d1a567663fcbc7b8c6da48bb3fffce1d862bd09a
MCD,2025-12-01 19:16:21,Time to Shore Up Your Personal Portfolio With These 3 Bullet-Proof Blue-Chip Stocks,Yahoo,https://finnhub.io/api/news?id=c02dbc282f925ae0785bd7b85ce983d1f075ffa11d90aa77c9b816fe3bf53d39
MCD,2025-12-01 18:53:19,2 Steadier Dividend Stocks If You’re Looking to Side-Step a Stock Market Correction,Yahoo,https://finnhub.io/api/news?id=0849305592f4b360c193fdd205f6fa0828fc755d2c06e58b113cff96e84d3db0
MCD,2025-12-01 16:07:00,"McDonald’s announces unexpected closure, sparking major backlash",Yahoo,https://finnhub.io/api/news?id=fe6f28eed30f004fb0b5ed8e17fb4bb2ec65766bb9aaccc097e61fbdf280f125
MCD,2025-12-01 14:29:00,"Merck, Amgen share losses lead Dow's nearly 350-point fall",MarketWatch,https://finnhub.io/api/news?id=800708634c9c164cce247bb01a4afe83144a422434c8557efa4357c876685157
MCD,2025-12-01 11:00:10,McDonald's Corporation (NYSE:MCD) is largely controlled by institutional shareholders who own 74% of the company,Yahoo,https://finnhub.io/api/news?id=46172778933a9540dc5c18663645c5d283c7b8086045b15f5b001389fd6b0a7f
NKE,2025-12-07 15:00:02,"As Nike Shakes Up Its C-Suite, Should You Buy, Sell, or Hold NKE Stock?",Yahoo,https://finnhub.io/api/news?id=3eea0c530b1d6591ad5af1f01b4786787d9b7fc008eae22f1c73305c7b2682e0
NKE,2025-12-05 22:06:20,"NIKE, Inc. (NKE): A Bear Case Theory",Yahoo,https://finnhub.io/api/news?id=c165f93f008eb11314bda0a63c4f2410fa8e33c20152bc349e51ba9979bc59a0
NKE,2025-12-05 20:30:00,"Shuffle Board: Vitale Leaves Versace, Nike’s Third Shake-Up",Yahoo,https://finnhub.io/api/news?id=faa1341adf05e244dcf18fc84376eec2d8702df6be0fdd832dbf0ecf0260857a
NKE,2025-12-05 14:00:05,"NIKE, Inc. (NKE) Is a Trending Stock: Facts to Know Before Betting on It",Yahoo,https://finnhub.io/api/news?id=62c9b23739971636e59f595783b9938abc4a7861f44625050ea68e3980919722
NKE,2025-12-05 04:33:24,3 Consumer Stocks That Concern Us,Yahoo,https://finnhub.io/api/news?id=a323531cfead2c14665e2eb0198c2e3db79ddf853ee9f1a84196afc8d4f04c3c
NKE,2025-12-04 20:27:56,Tracking Bill Ackman's Pershing Square 13F Portfolio - Q3 2025 Update,SeekingAlpha,https://finnhub.io/api/news?id=12345e4066e66d47d25c8e1c224d1e6dcec2d20aeca57c9f0b6db38d67893d02
NKE,2025-12-04 16:45:20,"GXO Logistics, Inc. (GXO): A Bull Case Theory",Yahoo,https://finnhub.io/api/news?id=15fecd9ff31c7ae96152edfe9fe85e99e899fb805577d006388d440968114250
NKE,2025-12-04 16:36:00,NIKE Stock Falls 11% in 3 Months: A Buy Opportunity or Value Trap?,Yahoo,https://finnhub.io/api/news?id=12ced19aca9361b255212d4500c83764e597555b31ed041845de7e99ffd11b33
NKE,2025-12-04 16:29:02,"Nike Unlikely to Post Material Surprises in Q2, RBC Capital Markets Says",Yahoo,https://finnhub.io/api/news?id=5ebcceb3dd28b9edd754ceb439d7ac4376fe426ad87ac2ec33728cacf4e93eaa
NKE,2025-12-04 12:11:59,Is Nike At $65 A Chance Or A Trap After Recent Strategy Reset?,Yahoo,https://finnhub.io/api/news?id=ed6b95b745f7bdc29d0794a8d9da4b5d04e00fce6c5f11de2236094310f58a76
NKE,2025-12-04 12:00:18,Adman Jimmy Smith Leads By Pushing The Envelope,Yahoo,https://finnhub.io/api/news?id=872becf48c1e557c6c0d2f3cc9fbdc235e5496609284942976fe1571e079d4d1
NKE,2025-12-04 09:47:00,Zacks Investment Ideas feature highlights: Lululemon Athletica and Nike,Yahoo,https://finnhub.io/api/news?id=f88329ffb8ab03a1b8e21b1666d3f3de6f96d2ad1f288f929d40fe0857d968fb
NKE,2025-12-04 09:07:38,Nike (NKE) Valuation Check After Leadership Overhaul and New COO Appointment,Yahoo,https://finnhub.io/api/news?id=7f0b0ecb67954beac1cc50c63349c097b94a7ac4154b9ed54a9d05c623230c67
NKE,2025-12-03 22:45:03,Why Nike (NKE) Outpaced the Stock Market Today,Yahoo,https://finnhub.io/api/news?id=0404b92f667992d12855e99b61e0618bcf090ad0e749e1f7a7e68ed9cc5af53f
NKE,2025-12-03 19:12:29,Nike and Lacoste Just Got Called Out--And It's a Game-Changer for Green Investing,Yahoo,https://finnhub.io/api/news?id=36ea4b3c9c905b8444940a5e4831eccefbf2720b83b3c5747d56973617e0c56c
NKE,2025-12-03 18:30:00,"Craig Williams, Former Jordan Brand President, Out At Nike",Yahoo,https://finnhub.io/api/news?id=1b5005fd084728b26c947f1dd0511e42a68edb9ed810687eddcd8e1a1bdbd88d
NKE,2025-12-03 16:50:11,UK Bans Nike Ads Over Green Claims,Yahoo,https://finnhub.io/api/news?id=333279b7afbdfd23188dc512676cf9418251eae09fe5a68a836fc004cb3c648c
NKE,2025-12-03 15:46:00,Can NIKE Stay Ahead as Global Sportswear Faces Tariff Headwinds?,Yahoo,https://finnhub.io/api/news?id=797af616ec8e05201390e249e51d132e7e1d6cf39e7fe6bc95354f5e51b2399e
NKE,2025-12-03 15:17:00,LULU Q3 EPS Preview: Are Shares Stretched to the Downside Enough?,Yahoo,https://finnhub.io/api/news?id=1bce03c2dfbfa47b5275294036d61d089c6f2413b222dc1ffe51ad316e19923c
NKE,2025-12-03 14:37:03,"Stocks to Watch Wednesday: Royal Bank of Canada, CrowdStrike, Dollar Tree",Yahoo,https://finnhub.io/api/news?id=89e6565d933dfc51033465ac13a555a9cdbace7b48281d71e0ca27a2d8a90f6e
NKE,2025-12-03 14:15:26,"Nike Before Q2: The Turnaround Story Everyone Wants, But Still Can't Quite See",SeekingAlpha,https://finnhub.io/api/news?id=868ecb407a33da17b6203db3c112ff6261b60e1457a192d477673b6093097f64
NKE,2025-12-03 13:40:00,"UnitedHealth, Nike share gains lead Dow's nearly 400-point climb",MarketWatch,https://finnhub.io/api/news?id=211dfdb5dfd6fa0b009c58590ffeeab9e504577a015a216b04dfa725f766585c
NKE,2025-12-03 13:38:13,Wall Street Lunch: Trump Administration Weighs Boosting U.S. Robotics To Compete With China,SeekingAlpha,https://finnhub.io/api/news?id=aa3f194fbf08ede110d92b35eba92d89c3fcdb930f66601068280edc481f02e3
NKE,2025-12-03 12:02:23,"Buy Verizon, December's Ideal ""Safer"" Dog Of The Dow",SeekingAlpha,https://finnhub.io/api/news?id=2667faafae3ff28b914df962f1f36c6af7bda25b202492689598e8cf884cc067
NKE,2025-12-03 11:34:00,"Dow's 270-point rally highlighted by gains in UnitedHealth, Nike shares",MarketWatch,https://finnhub.io/api/news?id=aa0c23ed91536c679fc9e2095e6ce9eba908f0388919a11fa5094a7e34b7cc3d
NKE,2025-12-03 11:13:00,"Nike cuts CTO, chief commercial roles in leadership overhaul",Yahoo,https://finnhub.io/api/news?id=ca6f19dd72fb3d1e47ba7f3a534d330b698306cd07b67a8222df67cb3d9d5bb7
NKE,2025-12-03 10:25:00,"Dow up nearly 150 points on gains for shares of UnitedHealth, McDonald's",MarketWatch,https://finnhub.io/api/news?id=ea5019515b07d28ae95e234fbaa3fcf29b9e9fa938ebab819abff3cabd5372a4
NKE,2025-12-03 10:15:53,"Nike shakes up leadership, scraps tech and commercial chiefs in reset",Yahoo,https://finnhub.io/api/news?id=4474c71bb47e9905786658f56992807612aa5d99f482d69efa52d492e3b72460
NKE,2025-12-03 08:05:00,"Nike, Superdry and Lacoste ads banned over 'misleading' sustainability claims",Yahoo,https://finnhub.io/api/news?id=d78046162bd03805f4f37f4839f696ae4260296304838dea055c039018916f23
NKE,2025-12-03 06:58:03,Wall Street Breakfast Podcast: Nike Makes Big 'Sport Offense' Roster Moves,SeekingAlpha,https://finnhub.io/api/news?id=0a1215d3038497afea5ac5fb562d83e383c2b4a8c79895236e9a76bd89f9d04c
NKE,2025-12-03 03:14:14,Is Nike’s New Tech-Centric COO Structure Rewiring the Investment Case for NKE?,Yahoo,https://finnhub.io/api/news?id=610f6b640103e051ad6d8565848ad63fb3ca77c05beb1cfe13fb63820ca50924
NKE,2025-12-03 00:01:00,"Nike, Superdry and Lacoste ads banned for exaggerating sustainability claims",Yahoo,https://finnhub.io/api/news?id=cc37d1854a71acec8578481c8fa590ed09063af0d4efe59a104348cdbbf8b8be
NKE,2025-12-02 22:59:00,Nike Shakes Up Leadership Team as Turnaround Plan Continues,Yahoo,https://finnhub.io/api/news?id=9b9d918f7cf9c8f6b894a2033b061657d7f3db459e0409ae5100212832e3e5ce
NKE,2025-12-02 22:39:45,Craig Williams to Leave Nike + More Changes to Senior Leadership Team at the Swoosh,Yahoo,https://finnhub.io/api/news?id=8a0313ec2c376ce489fae3e76a7ba1cc5465c31f8a39d7b5df0fe9dc6b10a0f9
NKE,2025-12-02 21:15:00,"NIKE, Inc. Announces Senior Leadership Changes to Accelerate ""Win Now"" Actions",Yahoo,https://finnhub.io/api/news?id=560937b0cbc6bceb4d151f12c87c1516d2fd4f6d97902834b271d24ea49cb6a8
NKE,2025-12-02 18:09:08,"Stock Market Today: MongoDB and Boeing Define Tuesday Rebound Trade; American Eagle, CrowdStrike, and Marvell Report",Yahoo,https://finnhub.io/api/news?id=625f0c54a272960749b3dcd6c94fc813265e405e620bfa4c0b828db4429dabab
NKE,2025-12-01 23:55:06,"StockX CEO on Black Friday Records, Nike Comeback",Yahoo,https://finnhub.io/api/news?id=df721288b9a2d4a2c6dcfbdd884b261d38c0319fd85161733ecef66e79a0d960
NKE,2025-12-01 21:38:25,"Stock Market Today: Indexes End Lower; Moderna Dives On FDA Memo; Synopsys, Nvidia Jump (Live Coverage)",Yahoo,https://finnhub.io/api/news?id=e735727e85f4bcd0f91f10139d7648c0c233d669693ebe449d6f6a8257b0f4a3
NKE,2025-12-01 20:49:00,3 Fresh Dividend Hikes That Might Be Telling You Something,Yahoo,https://finnhub.io/api/news?id=4e25f905e1baf80450a9a09b4ca5d58bd06f5be9235351780fb8afbc074d4f8d
NKE,2025-12-01 17:30:22,3 stock picks that have surprised investors in 2025,Yahoo,https://finnhub.io/api/news?id=abe21f1110b4f81a596d4f90630fd331622f753ebb3dd40366a010f065d68f04
NKE,2025-12-01 16:33:55,"EXCLUSIVE: Eileen Fisher, Reformation and Everlane Join Aii to Foster Change from Ground Up",Yahoo,https://finnhub.io/api/news?id=adcec3edf01836783c22deda098d4efc44b4ec9a76381d90d209ff097b7e8e52
NKE,2025-12-01 14:20:40,Top 10 High-Yield Dividend Stocks For December 2025,SeekingAlpha,https://finnhub.io/api/news?id=69b3f52f5b5a89b57682886655085f713a8a906a2dee318265f30aa235bf55b8
NKE,2025-12-01 13:05:42,"Final Trades: Nike, Amazon, Delta Air Lines and Apple",CNBC,https://finnhub.io/api/news?id=c797de1ca6d9892df67f8fb7ccf251d7c6b974eb1a90d8a7edf2f8e5e096c7c4
NKE,2025-12-01 12:30:01,How Amazon became America's biggest clothing seller,CNBC,https://finnhub.io/api/news?id=2bad84b55957caed51bea31101a6625969f897b01a9a09bd3af7ad9f801e5d5c
NKE,2025-12-01 12:25:01,How Amazon came to dominate the U.S. apparel market,CNBC,https://finnhub.io/api/news?id=72a287dc03f5b31fedce97c2283cdc1100ed70763ed23adfdf3b3436e3f18d08
NKE,2025-12-01 09:07:00,"NBA Finals 2025 Post Event Analysis Report Featuring 2K Sports, Nike, PepsiCo, Emirates Airline, Michelob Ultra, State Farm, Tissot, AT&T, American Express, Google",Yahoo,https://finnhub.io/api/news?id=7cd701ea167e05e2b33c786447c8ac316062512e6293ed5b93bc437bee2433aa
PG,2025-12-08 15:00:00,Tide Teams Up with Netflix’s Stranger Things 5 to Reimagine its 1987 Letters to Tide Campaign Featuring New Boosted Formula,Yahoo,https://finnhub.io/api/news?id=985b2b2b25c0de0bbcb1fb40a1d052710307003ba6c08a01a82758d856895518
PG,2025-12-07 07:30:00,The Generational Shift I See Now - And My 33 Stocks For What's Coming,SeekingAlpha,https://finnhub.io/api/news?id=1ab2bd597ffbe6e14c7e2501a16ea225c6478f648297e19c3747082f54162d00
PG,2025-12-06 18:50:00,How Good Has PG Stock Actually Been?,Yahoo,https://finnhub.io/api/news?id=4d7dbc8a1bc72c062a265a149693e92194514cbf7b1df47167071bc0a5bed8e7
PG,2025-12-06 09:11:16,Is Procter & Gamble Now a Value Opportunity After the 2025 Share Price Pullback?,Yahoo,https://finnhub.io/api/news?id=fbded17ceee93ebeebbdbee85549749b9ff0156d90993898cf74a4c9b5ecf370
PG,2025-12-06 08:00:00,"5 Relatively Secure And Cheap Dividend Stocks, Yields Up To 8% (December 2025)",SeekingAlpha,https://finnhub.io/api/news?id=d6ed4a34b734bdbc1905d0cfb7d6e3d7b7086d538ea28d742b56b4e3fc797ad1
PG,2025-12-05 22:50:02,Procter & Gamble (PG) Stock Drops Despite Market Gains: Important Facts to Note,Yahoo,https://finnhub.io/api/news?id=f8fa189ff82d270bfd249c91cc0bb082c8b510c58f962a4c552a6b523f549938
PG,2025-12-05 16:05:00,Dollar Tree Stock Will Go a Lot Further Than a Buck,Yahoo,https://finnhub.io/api/news?id=47c383b5fdfa6d85729d9e8cd9a959e7bfc4f1d0847dafe858b471110380445c
PG,2025-12-05 13:30:46,How Stock Markets Might React After The Federal Reserve's December Meeting,SeekingAlpha,https://finnhub.io/api/news?id=f33a107eae78728795ddf2ab92a699c1807aaa0444a17a62ded3a31f84e6eb61
PG,2025-12-05 11:08:00,"Zacks Industry Outlook Highlights Procter & Gamble, Church & Dwight, Ollie's Bargain Outlet and Grocery Outlet",Yahoo,https://finnhub.io/api/news?id=3402bf5f9ee38a9813ad93ca816ccf44d05335b24b67a2f57a0607732557497a
PG,2025-12-05 07:09:27,Procter & Gamble: A Cash Cow That Is Still A Sell,SeekingAlpha,https://finnhub.io/api/news?id=dcc9f4c7f29320cac3c3ec8ea5451410553b5ad08f3f01dc8409b701bac84c98
PG,2025-12-04 22:06:00,The Dividend Stocks That Keep Paying Even When Markets Stumble,Yahoo,https://finnhub.io/api/news?id=e67ecd4b16df23bc0d95e5ba788a29aee469cd99308114d05df05be1a09ce19e
PG,2025-12-04 16:30:14,Why Is Grocery Outlet (GO) Down 13.2% Since Last Earnings Report?,Yahoo,https://finnhub.io/api/news?id=5bef7acd0ed7ce50d25fb27fa735294823e549dbc0b92893a31c3cc8c8246d15
PG,2025-12-04 14:30:03,Earnings Growth & Price Strength Make Procter & Gamble (PG) a Stock to Watch,Yahoo,https://finnhub.io/api/news?id=02878b0ba0803130bc35c97512da43df79543a512e5906bf4267ce20f63b5920
PG,2025-12-04 13:19:00,4 Consumer Product Stocks to Watch as the Market Resets for 2026,Yahoo,https://finnhub.io/api/news?id=b009dcce6c71903f91e43a4dc2e5cdbebf6a4b48ad02a8f7980c1d1d0f6ae9ef
PG,2025-12-04 10:27:00,"The Zacks Analyst Blog Highlights Procter & Gamble, Lam Research, Texas Instruments, SandRidge Energy and Crown Crafts",Yahoo,https://finnhub.io/api/news?id=079d381bfbf0f4592d836abb466725e921edd77e5953418bf57404968c92d965
PG,2025-12-04 07:00:00,A Warning To Young Dividend Investors,SeekingAlpha,https://finnhub.io/api/news?id=df5d58ba839e6cc4a1dd2a47f3a2642c42e39df0eb9f74e2268c012ca8269ee4
PG,2025-12-03 21:51:00,"Top Stock Reports for Procter & Gamble, Lam Research & Texas Instruments",Yahoo,https://finnhub.io/api/news?id=656462fd9e17e7da57956682355361efb071cb7e43a64282d7371fe61c7e5954
PG,2025-12-03 19:16:57,P&G Braces For Weak U.S. Quarter,Yahoo,https://finnhub.io/api/news?id=1eebe4f4eae6c0654cb228a8cca29c18f3b2f43c3c67982f39172371067c0d04
PG,2025-12-03 18:07:54,The Dividend Income Strategy That Helps You Sleep Better at Night,Yahoo,https://finnhub.io/api/news?id=f4b43bfbf0f8cc63e2b5352954af27916f27df305f9bd8a5ef46a10f2dc3caef
PG,2025-12-03 18:06:52,Is Pantene’s New Hair-Loss Line a Subtle Shift in P&G’s (PG) Beauty Investment Focus?,Yahoo,https://finnhub.io/api/news?id=8cfeba4107fa4d254bc1e509ab03bc6b32aa3422c1faf167badd49ceab5a1688
PG,2025-12-03 14:18:00,"Company News for Dec 3, 2025",Yahoo,https://finnhub.io/api/news?id=6c5470c5514d21f9e4f8797dee350511a1bd9c976b0aa7d6b9182c3bfeb4e248
PG,2025-12-03 14:00:10,Are Investors Undervaluing The Procter & Gamble Company (NYSE:PG) By 21%?,Yahoo,https://finnhub.io/api/news?id=cb07b9bc160a1164ec3d86713be8b91706ae01261ccdd75f9eb631d19509c71a
PG,2025-12-03 12:02:23,"Buy Verizon, December's Ideal ""Safer"" Dog Of The Dow",SeekingAlpha,https://finnhub.io/api/news?id=2667faafae3ff28b914df962f1f36c6af7bda25b202492689598e8cf884cc067
PG,2025-12-02 21:50:01,Why Procter & Gamble Stock Hit a 2-Year Low on Tuesday,Yahoo,https://finnhub.io/api/news?id=0f5cb17420e8c6aa6200570add4720b395581779d75e2758cb346044a87b9fdf
PG,2025-12-02 21:45:00,"Stocks Rebound, and Bitcoin Makes Full Recovery From Monday’s Selloff",Yahoo,https://finnhub.io/api/news?id=50fda9d8bf44d52a3dc74c728d17d8137806c16eabff688dd953078c67d30352
PG,2025-12-02 21:17:22,"How major US stock indexes fared Tuesday, 12/2/2025",Yahoo,https://finnhub.io/api/news?id=dc7b13ae94ed3ed83cab137ef28e1a77578fa90b4d3f741ee649d2fb43a371ec
PG,2025-12-02 20:47:09,Sector Update: Consumer Stocks Mixed Late Afternoon,Yahoo,https://finnhub.io/api/news?id=6af0c1be276eb8d1e6af8c14a72fe9fb76cac8cdca4aac8e826e48d58301c683
PG,2025-12-02 18:52:01,Sector Update: Consumer Stocks Fall in Afternoon Trading,Yahoo,https://finnhub.io/api/news?id=96f5231f242ee2cdd340bb8a7388f7623e50a74e19194415ae7bd3d671d3923c
PG,2025-12-02 18:18:00,P&G Stock Drops. Its CFO Says Consumers Are Nervous.,Yahoo,https://finnhub.io/api/news?id=b6ffbf4b7bec3c16b8c986fb3382746ab5c5d9b6d88bdaf573cde7e3bf696849
PG,2025-12-02 17:52:18,US Equity Indexes Rise in Midday Trading as Bitcoin Rebound Signals Positivity in Risk Sentiment,Yahoo,https://finnhub.io/api/news?id=13ad83b178a71d4f73161d0d2cd860304995b63907ea189dbfc5f456254cd944
PG,2025-12-02 17:10:05,"Amazon: New AI models, plans to use Nvidia tech in its chips",Yahoo,https://finnhub.io/api/news?id=f9e13773b918b4280580ca7180a8a33b1697dbde37736fcce528937656640d77
PG,2025-12-02 16:39:00,Procter & Gamble's $1.5B Cost Savings Plan: Efficacy or Overreach?,Yahoo,https://finnhub.io/api/news?id=34fb1040e43ea969aee9418f85bd5535fd856498e16bd40b336b12d00848184f
PG,2025-12-02 16:32:18,Top Midday Stories: Boeing Expects to Increase Deliveries in 2026; Procter & Gamble CFO Says October Sales Down 'Significantly',Yahoo,https://finnhub.io/api/news?id=514096a39eaa914e607d80bdea351412e6fc8428a5016c72649e0c3670b0fd25
PG,2025-12-02 16:19:11,Procter & Gamble Stock Tests Two-Year Low After CFO Sounds Warning on Consumers,Yahoo,https://finnhub.io/api/news?id=c5bf80ffd5689928e29945e0162489fbd32102013183ffc8ec07e2ecdfd86254
PG,2025-12-02 14:00:04,Investors Heavily Search Procter & Gamble Company (The) (PG): Here is What You Need to Know,Yahoo,https://finnhub.io/api/news?id=8e9731b177fda58940208f2f426624f9cebf43429237e442714883be89bd0752
